Je souhaite un règlement sous les 7 jours MAXI .,SEN:7,e17p-288-7,LIT
"Cependant , vous pouvez acheter plusieurs objets sur un maximum de 2 périodes qui se suivent et régler dans un maximum de 15 jours car tous les autres frais à ma charge .",SEN:8,e17p-288-8,LIT
Je réponds aux questions bien entendu .,SEN:9,e17p-288-9,LIT
MODE d' ENVOI L' envoi de vos achats se fait en lettre bulle ou en colis que par la poste .,SEN:10,e17p-288-10,LIT
"En cas de demande de retour , elle sera acceptée que si elle est vraiment fondée et retour à votre charge dans les mêmes conditions que l' envoi initial , ( lettre suivie — colissimo avec ou sans assurance ) L' envoi se fait en lettre suivie ( 3 cm de H maxi ) ou colissimo pas de Mondial Relais pas pratique de chez moi .",SEN:11,e17p-288-11,LIT
"Le tarif des frais de port comprend : Les frais de la poste au plus juste , colissimo France et International , frais réels au centime près , lettre suivie juste arrondie à la dizaine supérieure exemple ( 100 g = 1,86 demandé 1,90 .",SEN:12,e17p-288-12,LIT
Aucun autre frais n' est facturé l' emballage reste à ma charge .,SEN:13,e17p-288-13,LIT
Vous enchérissez donc en connaissance de cause .,SEN:14,e17p-288-14,LIT
"Si vous voulez un envoi plus sécurisé à votre charge ( colis recommandé , il n' existe pas de recommandé pour les lettres suivies donc colis ) n' hésitez pas à me le faire savoir au moment du règlement .",SEN:15,e17p-288-15,LIT
"Je ne suis pas responsable des pertes de la poste Française , si vous prenez un mode d' envoi sans assurance , cela reste à vos risques et périls même si les pertes restent rares par la poste .",SEN:16,e17p-288-16,LIT
Je n' envoie pas dans certains pays ( voir liste ) car trop de pertes vraies ou fausses .,SEN:17,e17p-288-17,LIT
"Dans le cas d' une vente sans aucun règlement dans le délai de 7 J , un message de rappel vous est adressé , aucune réponse , ouverture d' un litige et mise en interdiction d' enchère sur mes ventes .",SEN:18,e17p-288-18,LIT
"Superbe bouton ancien en forme de fleur , au centre un strass et des petits brillants au niveau des pétales , les brillants n' ont pas tous la même luminosité et il en manque 2 31 mm , attache metal",SEN:0,e17p-289-0,LIT
"Très Beau Coupon Tissu pour Vêtements de Printemps Jersey Polyester Non Transparent Couleur Ecru Motifs légèrements en Reliefs Pour Robe , Jupe , 1 Coupon de 1,50 m en 150 cm Lavable machine pas de repassage",SEN:0,e17p-290-0,LIT
"Galon ruban vieux bleu brodé de fines fleurs longueur 3 M largeur 3 cm les photos font partie du descriptif Envoi soigné en lettre 3,10 € ( tarif pour la France ) Paiement PAYPAL ou par chèque Port groupé pour plusieurs achats Pour les destinations autres que la France , merci de me contacter pour connaître les frais d' envoi avant d' acheter",SEN:0,e17p-291-0,LIT
Pied presseur en acier pour machine à coudre industrielle type Brother Pfaff et Juki .,SEN:0,e17p-292-0,LIT
Piqûres droite avec compensateur .,SEN:1,e17p-292-1,LIT
Idéal pour vos travaux légers et lourds .,SEN:2,e17p-292-2,LIT
Lot de 7 boutons plastique - 4 trous - gris mauve reflets nacrés - 15 mm,SEN:0,e17p-293-0,LIT
un rouleau de 200 metres ruban dentelle elastique 12 mm neuf envoi par mondiale relais,SEN:0,e17p-294-0,LIT
2 petites boîtes en métal renfermant des brides pour corsages .,SEN:0,e17p-295-0,LIT
Envoi possible par Mondial Relay,SEN:1,e17p-295-1,LIT
"2 lots d' anciens boutons soit : 1 lot diamètre de 2 cms + 1 lot "" "" 1,5 cms pour un poids total de 980 g descriptif voir photos",SEN:0,e17p-296-0,LIT
BOUCLE DE CEINTURE MARQUE MALKA M.,SEN:0,e17p-297-0,ORAL
"PARIS TRAVAILLANT EN AUTRE POUR VERSACE DIMENSION 40 MM X 30 MM BICOLORE FABRIQUÉE EN FRANCE MODALITÉS DE PAIEMENT UNIQUEMENT PAYPAL CHÈQUE ACCEPTE DE 5 A 15 EUROS SEULEMENT RAPPEL DES CONDITIONS DE VENTES TOUTES ENCHÈRES REMPORTÉES SONT PAYABLES SOUS 7 JOURS , PASSE CE DÉLAI UNE PROCÉDURE DE LITIGE SERA ENGAGÉE .",SEN:1,e17p-297-1,LIT
"FRAIS D' ENVOIS ILS COMPRENNENT LES FRAIS D' EMBALLAGES ( BULLES , ENVELOPPES , ET ADHÉSIF ) DE MANUTENTION , DE CARBURANT JUSQU' AU LIEU DE L' EXPÉDITION , AINSI QUE L' EXPÉDITION PAR ELLE MÊME , EVALUATIONS : Chers clients , nous vous remercions tout d' abord pour l' achat que vous venez d' effectuer .",SEN:2,e17p-297-2,LIT
"Vendeurs , nous ne pouvons pas mettre d' évaluation neutre ou négative à un client , de ce fait , vous ne pouvez en aucun cas être victime de représailles , ou d' évaluations mensongères .",SEN:3,e17p-297-3,LIT
"Pour notre part , les évaluations d' acheteurs se font de plus en plus rares , nous avons donc décidé , de ne laisser nos petites étoiles qu' aux personnes s' étant données la peine de le faire .",SEN:4,e17p-297-4,LIT
Ce geste ne vous prendras moins de temps qu' il vous en a fallu pour lire paragraphe .,SEN:5,e17p-297-5,LIT
Merci par avance .,SEN:6,e17p-297-6,LIT
fond de mercerie comportant des bobines anciennes et des fils pour les broderies .,SEN:0,e17p-298-0,LIT
"COMPLET , LES JOINTS NE SONT PAS SEC ,",SEN:0,e17p-299-0,LIT
"Collecteur Termignoni SBK en Titane pour ZX-10R complet avec les 8 ressorts En plus de la sonorité qui se rapproche bientôt plus du Mirage2000 , et du gain de poids ( le carton et le papiers bulle pèserons plus lourd que le collecteur lui même ) , le collecteur permet de supprimer le catalyseur ( bye - bye",SEN:0,e17p-300-0,LIT
"l' Euro4 ) et de libérer le moteur ( sur la plage 5000trs/8000trs c' est très agréable , au delà ... c' est",SEN:1,e17p-300-1,LIT
"une zx-10r ,",SEN:2,e17p-300-2,LIT
donc je vous laisse imaginer ),SEN:3,e17p-300-3,LIT
