Effet plissé devant et derrière .,SEN:1,e18v-234-1,LIT
"Genoux un peu blanchi , mais pouvant vraiment être porté par un autre petit bonhomme .",SEN:2,e18v-234-2,LIT
"D' autres ventes sur mes comptes : selenchka ( où vous trouverez notamment beaucoup de paires de chaussures et de jouets ) et selenchka3 ( des livres , des vêtements pour femme , des bijoux neufs à offrir ou à s' offrir et des vêtements garçon et homme ) .",SEN:3,e18v-234-3,LIT
Je groupe les frais de port 2kgs = 4e mondial relay,SEN:4,e18v-234-4,LIT
Cet escarpin Accessoire Diffusion est vraiment très féminin .,SEN:0,e18v-235-0,LIT
Tout est parfait !,SEN:1,e18v-235-1,LIT
"Cet escarpin chausse normalement , Je vous conseille de prendre votre pointure habituelle .",SEN:2,e18v-235-2,LIT
Je mets en vente ma plush assez rare de Cloud de FF 7 .,SEN:0,e18v-236-0,LIT
Elle est vraiment en très bon état et a été très peu exposée .,SEN:1,e18v-236-1,LIT
"Un très joli luminaire un peu "" vintage "" , qui nécessite de la hauteur sous plafond car l' ensemble monté fait environ 1 m.",SEN:0,e18v-237-0,LIT
C' est la raison pour laquelle je le vends ( mon nouvel appartement ne permet pas de l' utiliser ) .,SEN:1,e18v-237-1,LIT
"Sinon je ne m' en serais pas séparé , car je le trouve vraiment superbe .",SEN:2,e18v-237-2,LIT
"Bien qu' il ne soit pas neuf , je ne lui connais pas de défaut d' aspect .",SEN:3,e18v-237-3,LIT
Somptueuse Escarpins Neuf Taille 39 Cuir Daim Noire Or Vraiment Magnifique Talons de 11 Cm Compensé de 2 Cm,SEN:0,e18v-238-0,LIT
TOUR PAT PATROUILLE état neuf je m en sépare car mon fils n’ a joué avec que 1 fois donc vraiment dans un état irréprochable tous fonctionne et idéal pour les enfants .,SEN:0,e18v-239-0,LIT
"bonjour , je vends parc pliant bébé de la marque française Combelle , en bois laqué marron accompagné d' un tapis de parc carré molletonné.prix",SEN:0,e18v-240-0,LIT
"neuf du parc : 129 euros parc et tapis en très bon état , j' ai gardé le carton d' emballage du parc pour le transport , j' offre le tapis de parc avec.parc",SEN:1,e18v-240-1,LIT
"pliable très pratique et vraiment joli , de très bonne qualité et robuste . Dimensions",SEN:2,e18v-240-2,LIT
": 92 x 98 x H 63 cmParc plié , épaisseur : 11 cmPoids : 8 kg Remise en main propre , n' hésitez pas à me contacter , merci",SEN:3,e18v-240-3,LIT
"Appareil photo numérique de marque Nikon , modèle cool pix a10 , neuf .",SEN:0,e18v-241-0,LIT
"Je l’ avais acheté pour partir en vacances mais je m’ en suis servi qu’ une ou deux fois , les piles sont donc à 99,9 % non utilisées .",SEN:1,e18v-241-1,LIT
La carte mémoire est bien sûr fournie avec l’ adaptateur et est déjà formatée .,SEN:2,e18v-241-2,LIT
"La qualité est plus que correcte , les photos et vidéos peuvent être vraiment sympa .",SEN:3,e18v-241-3,LIT
Après ce n’ est pas un appareil professionnel ne vous attendez pas à avoir la qualité d’ un reflex à 1500 € ...,SEN:4,e18v-241-4,LIT
Comme il a été acheté le mois dernier il y a encore la garantie d’ achat ( attention pas de garanties type vol ou casse ),SEN:5,e18v-241-5,LIT
Vends Manette PS4 V2 comme neuve .,SEN:0,e18v-242-0,LIT
"Manette utilisée comme manette secondaire n’ a servie que 3 fois , vraiment dans un état proche du neuf Facture d’ achat fournie avec la manette .",SEN:1,e18v-242-1,LIT
4 jeans femme en bon état taille 34 1 violet marque Pimkie 1 Blanc marque Kiss Kiss 1bleu ciel taille 36 mais taille petit donc 34 1 bleu clair taille 36 mais taille petit donc 34 T.S,SEN:0,e18v-243-0,LIT
"marque Onado blanc jean : entre jambe 84 cm taille 34/36 ( tissu un peu élastique ) bleu ciel : "" "" "" "" "" "" "" "" "" "" "" "" "" "" "" "" "" "" 83 cm "" "" "" "" "" "" 36/38 "" "" "" "" "" "" "" "" "" "" "" "" "" "" "" "" "" "" "" "" "" "" "" "" "" "" "" "" "" "" violet : "" "" "" "" "" "" "" "" "" "" "" "" "" "" "" "" "" "" "" 78 cm "" "" "" "" "" "" "" "" 36/38 "" "" "" "" "" "" "" "" "" "" "" jean delavé "" "" "" "" "" "" "" "" "" "" "" "" "" "" "" 75 cm "" "" "" "" "" "" "" "" "" 35/37 "" "" "" "" "" "" "" "" "" "" "" "" "" "" "" "" "" "" "" "" "" "" "" "" "" "" "" "" "" les 4 ont été portés donc quelques trace d' usure vraiment minime",SEN:1,e18v-243-1,LIT
Je vends une Canada Goose Chilliwack Authentique Homme taille M qui taille relativement petit donc même ceux qui portent du S peuvent la porter ( C' est le style bomber de la parka qui est voulu ) .,SEN:0,e18v-244-0,LIT
Je peux me déplacer dans tout Paris ; Possibilité d' essayer avant l' achat .,SEN:1,e18v-244-1,LIT
"Elle tient vraiment très chaud en hiver , très bon rembourrage , confortable .",SEN:2,e18v-244-2,LIT
Le prix initial est de 825 Euros ( Vérifiable sur internet ) et je la vends au prix 250 Euros non négociable ; la fourrure étant usée car elle est malheureusement passée au lavage .,SEN:3,e18v-244-3,LIT
Pour plus d' informations ainsi que de photos n' hésitez pas à envoyer un message .,SEN:4,e18v-244-4,LIT
"Pour le paiement j' accepte par virement bancaire / paypal ou par cash , Pour l' échange je peux me déplacer sur tout Paris , si il le faut Je peux envoyer par colis à mes frais .",SEN:5,e18v-244-5,LIT
Si besoin pas contactez moi au 06.43.27.48.25,SEN:6,e18v-244-6,LIT
Comme neuf Soulever des cubes à l' aide d' une grue et les transporter dans un camion est vraiment amusant .,SEN:0,e18v-245-0,LIT
"Jouer ainsi permet de développer la motricité fine , l' esprit logique et la coordination oeil - main",SEN:1,e18v-245-1,LIT
de l' enfant . Structure,SEN:2,e18v-245-2,LIT
en bois solide qui supporte les conducteurs les plus exigents et les nombreux transports . La,SEN:3,e18v-245-3,LIT
"grue et les cubes comportent un aimant , ce qui facilite le levage et le chargement . La",SEN:4,e18v-245-4,LIT
remorque se détache . La,SEN:5,e18v-245-5,LIT
ficelle sur l' avant du camion permet de le tirer facilement . Bon,SEN:6,e18v-245-6,LIT
à savoirAdapté aux enfants de 12 mois et plus . Ce,SEN:7,e18v-245-7,LIT
produit porte la marque CE.Conseil,SEN:8,e18v-245-8,LIT
d' entretienNettoyer avec de l' eau savonneuse . Terminer,SEN:9,e18v-245-9,LIT
en essuyant avec un chiffon sec.32,SEN:10,e18v-245-10,LIT
"cm de long Au plus haut 22 cm Si vous achetez plusieurs articles , demandez votre facture groupée ! ! !",SEN:11,e18v-245-11,LIT
ACCEPTE PAYPAL SOUS CONDITIONS CONTACTEZ MOI POUR PLUS D' INFORMATIONS,SEN:12,e18v-245-12,ORAL
Je cède ma jolie guitare Alhambra 4f flamenca amplifier avec un ampli fishman pro rajouter et poser chez alhambra serie limiter golpeador personaliser la guitare est encore garanti un 1 ans facture a l appuie bonne sonorité fournie dans sa valise de transport avc un accordeur que j offre elle et en super etat car je suis munitieux nettoyer apres chaque utilisation et polish du bois tout les mois par magasin de musique serie limiter il ne la fabrique plus chez alhambra je tien a preciser que rey baliardo du groupe des gipsy kings a jouer dessus je possede la dedicasse ces vraiment une tres bonne guitare pour plus d informations ou photo me demander merci,SEN:0,e18v-246-0,LIT
REALLY RARE MODEL GUNDAM KASTRYSHA 1/100 KIT OF PLAMODEL BRAND WITH SYSTEM LED AND METALLIC PART.THIS,SEN:0,e18v-247-0,ORAL
KIT IS EXTREMELY RARE AND IS NOT MANUFACTURED FOR SEVERAL YEARS.SOLD,SEN:1,e18v-247-1,ORAL
"COMPLETE NEW AND NOT UP , JUST UNPACK TO MAKE PICTURES .",SEN:2,e18v-247-2,LIT
VRAIMENT RARE MODEL KIT GUNDAM KASTRYSHA 1/100 DE LA MARQUE PLAMODEL AVEC SYSTEM LED ET PARTIE MÉTALLIQUE .,SEN:3,e18v-247-3,LIT
CE KIT EST EXTRÊMEMENT RARE ET N' EST PLUS FABRIQUE DEPUIS PLUSIEURS ANNÉES .,SEN:4,e18v-247-4,LIT
"VENDU COMPLET NEUF ET NON MONTER , JUSTE DÉBALLER POUR FAIRE LES PHOTOS .",SEN:5,e18v-247-5,LIT
VEND CHAUSSURE ENFANT CAMPER BLEU DANS L ENSEMBLE ET TALON ROSE ET VERT PALE TAILLE 33 VRAIMENT LA QUALITÉ BIEN CHER EN BOUTIQUE,SEN:0,e18v-248-0,LIT
Processeur ryzen 3 2200 g de dernière génération avec carte graphique intégrée ( on peut vraiment joué avec ) Je le vends parce que je me suis payé un ryzen 7 .,SEN:0,e18v-249-0,LIT
"Je fais pas mal de retouche photo et vidéo , donc il me fallait plus de puissance .",SEN:1,e18v-249-1,LIT
"Il est vendu avec sa boîte ( ventirad inclus non utilisé ) et la pâte thermique de marque noctua d' une valeur de 12 € chez ldlc ( du haut de gamme ) Pour info , si vous utilisez le ventirad inclus , enlever d' abord la pâte qui est dessus avec un chiffon .",SEN:2,e18v-249-2,LIT
"ETAT PROCHE DU NEUF , portés 2 jours GRANDES BOTTES EN BEAU CUIR LISSE ET VEAU VELOURS MARRON DANS LEUR BOITE D' ORIGINE * * * *",SEN:0,e18v-250-0,LIT
BLUEGENEX * * * *,SEN:1,e18v-250-1,ORAL
"POINTURE 37 Talon 4 cm environ , en beau cuir lisse , et veau velours à l' arrière , la tige avant est plus longue que l' arriere Bout carré , grande fermeture zip sur le coté , intérieur cuir bleu glacé Hyper confortables et vraiment très propres Envoi rapide et soigné en mondial relai",SEN:2,e18v-250-2,LIT
magnifique livre de collection napoleon et l angletterre papier glacé magnifique ouvrage juste petit acros sur page de garde vraiment tres leger sinon livre impecable,SEN:0,e18v-251-0,LIT
"etat correct , non deformés ; un tout petit peu de bouloches mais vraiment rien",SEN:0,e18v-252-0,LIT
TRES BEAU DESSIN A L' ENCRE DE CHINE de la PLACE D' ARMES DE CAMBRAI Il a été réalisé sur un panneau type Isorel .,SEN:0,e18v-253-0,LIT
"Il n' est pas signé , ni daté .",SEN:1,e18v-253-1,LIT
Il a été inspiré ( ou a servi de modèle ? ),SEN:2,e18v-253-2,LIT
"à l' illustration reprise dans l' ouvrage de 1888 "" Le Nord pittoresque de la France "" par Henri Cons ( voir photos ) .",SEN:3,e18v-253-3,LIT
"La place d' armes détruite pendant la première guerre mondiale est parfaitement reproduite ici ( voir photos ) , telle qu' elle était à la fin du XIXème siècle .",SEN:4,e18v-253-4,LIT
"Par contre , le panneau type Isorel pourrait suggérer que ce dessin a plutôt été réalisé tout début XXème siècle .",SEN:5,e18v-253-5,LIT
Je n' en sais pas plus et vous laisse le soin de juger .,SEN:6,e18v-253-6,LIT
"Quoi qu' il en soit , ce dessin est vraiment très joli .",SEN:7,e18v-253-7,LIT
"Dimensions : 40 cm x 29,5 cm Envoi par Mondial Relay bien protégé .",SEN:8,e18v-253-8,LIT
"Pour tout envoi hors de France , me consulter impérativement avant d' enchérir ...",SEN:9,e18v-253-9,LIT
Très jolie écharpe pour bébé bleu ciel tricote main taille 1 mois en phildouce De chez phildar elle mesure 10 cm de large et 60 cm de long il faut 1pelote De laine pour la faire elle est super douce ne pique pas ne laisse pas de peluche sur les mains dès bébé elle est vraiment magnifque,SEN:0,e18v-254-0,LIT
"cache HARLEY DAVIDSON ORIGINAL occasion , petites traces de choc ( vraiment petites ) valeur neuf = 45 € port colissimo France = 8 € CEE = 15 €",SEN:0,e18v-255-0,LIT
Voici un CD - Rom passionnant sur l' histoire d' une BD culte : MAUS de Art Spiegelman .,SEN:0,e18v-256-0,LIT
Il contient une mine d' informations pour qui s' intéresse à cette œuvre majeure du neuvième art .,SEN:1,e18v-256-1,LIT
Je vous en détaille la construction ci dessous : MAUS L' INTÉGRALE 1ère partie : - Maus le making - of,SEN:2,e18v-256-2,LIT
: *,SEN:3,e18v-256-3,LIT
Pourquoi un CD - Rom *,SEN:4,e18v-256-4,ORAL
Interviewer Vladek *,SEN:5,e18v-256-5,ORAL
Définir la page *,SEN:6,e18v-256-6,LIT
A la recherche de la page *,SEN:7,e18v-256-7,LIT
"Fignoler la page - Tome 1 : version numérique , page par page , de la totalité du tome 1 + possibilité de cliquer sur certaines cases ou planches pour en découvrir les esquisses préparatoires .",SEN:8,e18v-256-8,LIT
"- Tome 2 : version numérique , page par page , de la totalité du tome 2 + possibilité de cliquer sur certaines cases ou planches pour en découvrir les esquisses préparatoires .",SEN:9,e18v-256-9,LIT
- L' art selon Art : extraits d' un entretien de 1993 avec Art Spiegelman .,SEN:10,e18v-256-10,LIT
Seconde partie : - les suppléments de MetaMaus *,SEN:11,e18v-256-11,LIT
Entretiens avec Vladek : documents audio et transcriptions inédites .,SEN:12,e18v-256-12,LIT
*,SEN:13,e18v-256-13,ORAL
Souvenirs d' Anja : entretiens avec des femmes qui ont connu Anja dans les camps et après .,SEN:14,e18v-256-14,LIT
*,SEN:15,e18v-256-15,ORAL
La bibliothèque d' Anja : publications polonaises d' après-guerre,SEN:16,e18v-256-16,LIT
sur les ghettos et les camps de la mort .,SEN:17,e18v-256-17,LIT
*,SEN:18,e18v-256-18,ORAL
L' arbre généalogique : généalogie et histoire de la famille .,SEN:19,e18v-256-19,LIT
*,SEN:20,e18v-256-20,ORAL
Le film amateur de Art et Françoise à Auschwitz .,SEN:21,e18v-256-21,LIT
*,SEN:22,e18v-256-22,ORAL
Carnets de Maus ( 1983 - 1990 ) .,SEN:23,e18v-256-23,LIT
*,SEN:24,e18v-256-24,ORAL
Le grenier : plus de 7500 esquisses et brouillons de vignettes .,SEN:25,e18v-256-25,LIT
et bien d' autres suppléments encore !,SEN:26,e18v-256-26,LIT
"Bref je retiendrai aussi la beauté des nombreuses recherches graphiques de l' auteur , qui affine ses brouillons peu à peu aux feutres de couleurs , leur conférant un style si particulier proche du Pop' art .",SEN:27,e18v-256-27,LIT
"Qu' on ne s' y trompe pas , MetaMaus n' est pas un guide de lecture de Maus .",SEN:28,e18v-256-28,LIT
C' est un recueil d' interviews d' une rare richesse documentaire qui retrace la genèse d' une œuvre majeure .,SEN:29,e18v-256-29,LIT
Comme vous l' aurez compris j' ai vraiment apprécié parcourir ce CD - Rom .,SEN:30,e18v-256-30,LIT
"Un bon complément de lecture , pour aller plus loin et découvrir tout ce qu' il y a derrière , tout le fond et toute l' humanité qu' il y a chez cet artiste / dessinateur unique .",SEN:31,e18v-256-31,LIT
"Je finis par cette citation de Art Spiegelman : « Le sujet de Maus , c' est la récupération de la mémoire et , en fin de compte , la création de la mémoire » .",SEN:32,e18v-256-32,LIT
CD - Rom en parfait état dans une pochette neutre .,SEN:33,e18v-256-33,LIT
Quelques exemplaires seulement en stock .,SEN:34,e18v-256-34,LIT
Envoi rapide et soigné .,SEN:35,e18v-256-35,LIT
Détails techniques : CD - Rom Configaration requise : windows XP ou postérieur .,SEN:36,e18v-256-36,LIT
Intel ou PwerPC Macinstosh Mac OS x 10.4,SEN:37,e18v-256-37,ORAL
ou plus Résolution d' écran recommandée 1024x768 ou plus Nécessite Quicktime .,SEN:38,e18v-256-38,LIT
incroyable !,SEN:0,e18v-257-0,ORAL
voici un élément particulier !,SEN:1,e18v-257-1,LIT
cette ensemble de sous-bock,SEN:2,e18v-257-2,LIT
est dans un bon état !,SEN:3,e18v-257-3,LIT
souvenir d' un temps passé !,SEN:4,e18v-257-4,LIT
"c' est un ensemble , émouvant sur l ' image de monnaies anciennes !",SEN:5,e18v-257-5,LIT
"pour promouvoir , égayer vos soirée !",SEN:6,e18v-257-6,LIT
des sous-bocks,SEN:7,e18v-257-7,LIT
vraiment sympa !,SEN:8,e18v-257-8,ORAL
"collectionneurs des monnaies , ou para - monnaies",SEN:9,e18v-257-9,LIT
?,SEN:10,e18v-257-10,ORAL
objet insolite !,SEN:11,e18v-257-11,ORAL
à posséder !,SEN:12,e18v-257-12,LIT
"Vend BanjoClavero années 30 en super état , sonne incroyablement bien , les medium sont vraiment incroyable .",SEN:0,e18v-258-0,LIT
Bref superbe instrument dont je me sépare à contre coeur .,SEN:1,e18v-258-1,LIT
"Il a 17 frettes , toutes les mécaniques fonctionnent super , la peau est nikel , la marqueterie n' a pas bougé , juste quelques marques d' usures dû à l' âge , ainsi que le métal qui est un peu piqué mais rien de bien méchant ( voir les photos ) merci !",SEN:2,e18v-258-2,LIT
Manteau fourrure ZAPA T36 Manteau en laine ZAPA modèle Gabie .,SEN:0,e18v-259-0,LIT
Couleur noire .,SEN:1,e18v-259-1,LIT
Taille 36 .,SEN:2,e18v-259-2,LIT
Coupe cintrée légèrement trapèze .,SEN:3,e18v-259-3,LIT
80 % laine .,SEN:4,e18v-259-4,LIT
Capuche avec magnifique fourrure amovible.(la,SEN:5,e18v-259-5,LIT
fourrure est bien garnie et vraiment magnifique ! ! ! ),SEN:6,e18v-259-6,LIT
2 grandes poches + 2 poches zippées .,SEN:7,e18v-259-7,LIT
Finitions cuir autour des zip .,SEN:8,e18v-259-8,LIT
"Acheté en décembre 2017 , en très bon état .",SEN:9,e18v-259-9,LIT
Modèle reconduit chaque année .,SEN:10,e18v-259-10,LIT
Dimensions : Épaule à épaule 38 cm Aisselle à aisselle 41 cm Longueur 69 cm Longueur manches 60 cm .,SEN:11,e18v-259-11,LIT
Tous mes produits sont authentiques ! ! ! !,SEN:12,e18v-259-12,LIT
Imperméable de marque Sergent Major .,SEN:0,e18v-260-0,LIT
Taille 5 ans ( taille grand peut convenir à un 6 ans ) .,SEN:1,e18v-260-1,LIT
En bon état général néanmoins les cerises ont décoloré au lavage ou avec la pluie et on légèrement fait des traces sur la toile enduite à certains endroits .,SEN:2,e18v-260-2,LIT
"Se voit à peine surtout lorsque le ciré est porté , il mérite vraiment une seconde vie .",SEN:3,e18v-260-3,LIT
"Attention : les enchères ne sont pas un jeu , n' enchérissez que si vous souhaitez acheter .",SEN:4,e18v-260-4,LIT
Règlement uniquement en mode PayPal entre proche .,SEN:5,e18v-260-5,LIT
Paiement attendu sous 2 jours max .,SEN:6,e18v-260-6,LIT
"Magnifiques bottines de la marque SARTORE en taille 37 , de couleur rouge bordeaux .",SEN:0,e18v-261-0,LIT
Toutes en cuir semelle intérieur et dessus cuir .,SEN:1,e18v-261-1,LIT
Modèle très haut de gamme .,SEN:2,e18v-261-2,LIT
Valeur 639euros .,SEN:3,e18v-261-3,LIT
Je les vend vraiment à regret car j' ai flashé dessus et je n' ai pas résisté à les acheter mais elles sont un peu trop justes pour moi je fais habituellement du 38 donc je pense pouvoir dire Qu elles chaussent un peu grand .,SEN:4,e18v-261-4,LIT
"Idéal je pense pour un 37,5 .",SEN:5,e18v-261-5,LIT
Je n' ai plus la boîte d' origine mais comme vous pouvez le voir elles n' ont pas été portées .,SEN:6,e18v-261-6,LIT
Maison non fumeur et sans animaux .,SEN:7,e18v-261-7,LIT
Pour toute question n' hésitez pas à me contacter Livraison en relais colis avec mondial relay pour réduire les frais d' expédition et apporter un suivi .,SEN:8,e18v-261-8,LIT
Merci d en tenir compte lors de la validation de votre commande Merci de votre visite,SEN:9,e18v-261-9,LIT
"Assiette plate 26 , 5 cms environ Modèle Amapola de VILLEROY et BOCH Légères traces d' usage sur le fond de l' assiette , pas vraiment visibles Pas ébréchée 5 assiettes disponibles",SEN:0,e18v-262-0,LIT
Un ensemble chic de chez PAUL BRIAL - Taille S Longueur de la jupe ( avec dentelles ) : 55 cm Smocks à la taille .,SEN:0,e18v-263-0,LIT
IMPECCABLE !,SEN:1,e18v-263-1,ORAL
Vraiment une bonne affaire .,SEN:2,e18v-263-2,LIT
Photos et renseignements complémentaires sur demande Groupez vos commandes pour diminuer le coût final !,SEN:3,e18v-263-3,LIT
Je calcule les frais au plus juste pour les livraisons groupées .,SEN:4,e18v-263-4,LIT
"Envoi en Point Relais = 4,00 € pour achats jusque 2 kg .",SEN:5,e18v-263-5,LIT
"Demander le total avant paiement , merci .",SEN:6,e18v-263-6,LIT
"Vend polo de marque "" vicomte Arthur "" authentique t.4ans",SEN:0,e18v-264-0,LIT
", rose Petit trou vraiment a peine visible ( voir 3eme photo ) que je préfère préciser",SEN:1,e18v-264-1,LIT
vend ce lot de jeux ds et 3ds vraiment en tres tres bonne etat avec un poster geant,SEN:0,e18v-265-0,LIT
JE VEND BEAUCOUP DE VÊTEMENTS CAR CHANGEMENT DE TAILLE VRAIMENT EN TRÈS BON ÉTAT PULL NOIR HOMME MARQUE CACHEMIRE TAILLE S 35 % POLYESTER 29 % VISCOSE 20 % LAINE 10 % CACHEMIRE 6 % ANGORA,SEN:0,e18v-266-0,LIT
Légère Très agréable à porter Je regrette qu' elle me soit trop petite car vraiment mignonne !,SEN:0,e18v-267-0,LIT
Quasi neuve,SEN:1,e18v-267-1,ORAL
Une nouvelle version simple mais vraiment bonne de la robe superposée grâce à un top raccourci cousu .,SEN:0,e18v-268-0,LIT
"En un mot : ajoutez un peu de volume , ajoutez un peu de style .",SEN:1,e18v-268-1,LIT
"- Encolure arrondie - Sans manches - Coupe légèrement trapèze - Superposition courte 97 % polyester , 3 % élasthann 38 Neuve avec étiquette",SEN:2,e18v-268-2,LIT
Chouette jean issu d' une collab entre Marcel Von Berlin et le géant bpc .,SEN:0,e18v-269-0,LIT
Coupe slim / taille basse .,SEN:1,e18v-269-1,LIT
"En jean noir travaillé used et habillé de nombreux patchs ( Hollywood , be yourself , lunettes , bonbons , champ ... ) .",SEN:2,e18v-269-2,LIT
Seyant et super confortable .,SEN:3,e18v-269-3,LIT
Taille 46 .,SEN:4,e18v-269-4,LIT
Porté une fois .,SEN:5,e18v-269-5,LIT
Une très jolie pièce qui matche vraiment super bien !,SEN:6,e18v-269-6,LIT
Voiture hornby ARCADIA en état correct de jeu.présence,SEN:0,e18v-270-0,LIT
du soufflet d' interconnexion .,SEN:1,e18v-270-1,LIT
fabriquée en Angleterre.pas,SEN:2,e18v-270-2,LIT
"de manques , écailles de peinture . Voir",SEN:3,e18v-270-3,LIT
les photos.paiement,SEN:4,e18v-270-4,LIT
par chèque souhaité pour les acheteurs français car Paypal génère vraiment trop de frais .,SEN:5,e18v-270-5,LIT
merci,SEN:6,e18v-270-6,ORAL
Jupe comme neuve .,SEN:0,e18v-271-0,LIT
Classique ...,SEN:1,e18v-271-1,ORAL
Vraiment portée 1 - 2 fois Marque italienne tres connu - Sergo Tacchini Couleur bleu marine Porte-feuille,SEN:2,e18v-271-2,LIT
"devant et plisse derrière Taille 40 italienne , 36 française et US - 6 65 % polyester + 35 % coton Fermeture boutons devant Dimensions a plat : taille 30 cm ; longueur - 33 cm",SEN:3,e18v-271-3,LIT
Vends superbe veste légère en cuir de buffle REDSKINS .,SEN:0,e18v-272-0,LIT
"Taille XL , la veste a une dizaine d' années mais est en parfait état , le cuir en très bon état général , sauf les boutons se sont décousu au fil des ans , il faudra prévoir d' en remettre où non ....",SEN:1,e18v-272-1,LIT
Au choix ..,SEN:2,e18v-272-2,LIT
Cette veste est vraiment très légère et c' est l' idéal en milieu de saison comme maintenant pour le printemps .,SEN:3,e18v-272-3,LIT
De couleur noire cette veste peut se porter avec tout ...,SEN:4,e18v-272-4,LIT
Valeur neuve il y a une dizaine d' années : 350 euros .,SEN:5,e18v-272-5,LIT
Vendu 69 euros ...,SEN:6,e18v-272-6,ORAL
"Livraison en colissimo suivi recommandé , ou point relais colis au choix .",SEN:7,e18v-272-7,LIT
"Si vous avez des questions , n' hésitez pas à me contacter par mail .",SEN:8,e18v-272-8,LIT
Bonne enchères .,SEN:9,e18v-272-9,ORAL
"Superbe robe en velours ras noir marque BRAVE SOUL taille M ce qui correspond à un 38 40 petit 42 Velours imprimé motifs cachemire sur le plastron devant Modèle actuel , le velours est À la mode cet hiver Galon brodé aux manches et autour du plastron , vraiment de toute beauté ! ! !",SEN:0,e18v-273-0,LIT
Très élégantes low boots Nine West .,SEN:0,e18v-274-0,LIT
"Talons 11,5 cm .",SEN:1,e18v-274-1,LIT
Bi-matière,SEN:2,e18v-274-2,ORAL
: daim à l' avant et cuir lisse à l' arrière .,SEN:3,e18v-274-3,LIT
Fermeture par zip à l' arrière .,SEN:4,e18v-274-4,LIT
Vraiment très jolies !,SEN:5,e18v-274-5,LIT
"Bracelet jonc deux barres , deux T parallèles .",SEN:0,e18v-275-0,LIT
Ce bracelet est ouvert et peut être réglé comme bon vous semble .,SEN:1,e18v-275-1,LIT
"Ayant une finition martelé , il a un effet de vague mouvante sur le poignet .",SEN:2,e18v-275-2,LIT
Ce qui est vraiment joli .,SEN:3,e18v-275-3,LIT
Il peut être porté seul ou à plusieurs avec d' autres bracelets notamment .,SEN:4,e18v-275-4,LIT
Ce bracelet existe en argenté acier inoxydable ou doré plaqué or ( Notifiez moi votre choix lors de l' achat ) = > Diamètre : 5 cm réglable = > Matériaux : Acier inoxydable et plaqué or = > Finition : martelé = > Matériaux de haute qualité Livré joliment dans un pochon en soie protégé dans une enveloppe à bulle .,SEN:5,e18v-275-5,LIT
"Superbe Bronze à patine sombre Noire , des années 50 style Art Deco Dans l' esprit de Mayodon et Buthaux , pas de signature , si vous avez des infos , merci beaucoup .",SEN:0,e18v-276-0,LIT
La pièce est vraiment superbe .,SEN:1,e18v-276-1,LIT
"Dimensions : 33,5 * 27",SEN:2,e18v-276-2,LIT
cm Colis soigné,SEN:3,e18v-276-3,LIT
"très bon état avec histoire , jeux , coloriages à faire et construction d' un vieux tacot en papier , vraiment très bon état",SEN:0,e18v-277-0,LIT
Pour les fans des années 90 ...,SEN:0,e18v-278-0,LIT
ou pour agrandir sa collection !,SEN:1,e18v-278-1,LIT
...,SEN:2,e18v-278-2,ORAL
ou pour décorer avec originalité son sapin de noël ! ! !,SEN:3,e18v-278-3,LIT
"Lot de 5 figurines RAZMOKET , La bande des bébés de trois mois à trois ans vraiment diablotins ! ! !",SEN:4,e18v-278-4,LIT
Tommy « Casse-bonbon,SEN:5,e18v-278-5,LIT
» Cornichon Charles - Édouard,SEN:6,e18v-278-6,LIT
« la Binocle » Fifrelin Alphonse et Sophie « les Grumeaux » De La Tranche Angelica « Couette - Couette,SEN:7,e18v-278-7,LIT
» En excellent état * * *,SEN:8,e18v-278-8,LIT
Lot remis en mains propres à TOULON ou envoi Mondial Relay * * *,SEN:9,e18v-278-9,LIT
Vends chemisier Jacqueline Riu T46 .,SEN:0,e18v-279-0,LIT
Manches 3/4 légèrement évasées .,SEN:1,e18v-279-1,LIT
Col en V.,SEN:2,e18v-279-2,LIT
Couleur rose - fuschia .,SEN:3,e18v-279-3,ORAL
Ceintré .,SEN:4,e18v-279-4,LIT
Vraiment très élégant,SEN:5,e18v-279-5,LIT
"Novation Launchpad Ableton - Contrôleur à pads MIDI Fruit de l' étroite collaboration entre Novation et Ableton , le Launchpad s' intègre instantanément et en toute transparence au logiciel Live d' Ableton , vous offrant une solution puissante et musicale pour contrôler et interagir visuellement avec Live .",SEN:0,e18v-280-0,LIT
"Maintenant vous pouvez vraiment jouer "" Live "" !",SEN:1,e18v-280-1,LIT
Avec sa matrice de 64 boutons rétro-éclairés,SEN:2,e18v-280-2,LIT
"et ses boutons dédiés au lancement des scènes , le Launchpad a été spécialement conçu pour déclencher et manipuler des clips dans Live .",SEN:3,e18v-280-3,LIT
Il offre également un nouveau et très excitant mode de contrôle du mixeur de Live .,SEN:4,e18v-280-4,LIT
"Spécialement étudié pour Live , le Launchpad est livré avec une version d' Ableton Live "" Launchpad Edition "" , mais il n' est pas uniquement cantonné à cette tâche .",SEN:5,e18v-280-5,LIT
