"in English , very rare press kit , exclusive , 2018 , PS4Very rich content .",SEN:0,e18v-201-0,LIT
media press kit numbered . The,SEN:1,e18v-201-1,LIT
box is larger than that usually given for PlayStation press kits .,SEN:2,e18v-201-2,LIT
"White , she wears the symbol of the spider - man",SEN:3,e18v-201-3,LIT
"on a silver and textured background , like a canvas !",SEN:4,e18v-201-4,LIT
"By opening it , we come across an amazing visual of Spider - Man ,",SEN:5,e18v-201-5,LIT
"and on the content . First ,",SEN:6,e18v-201-6,LIT
"there is a copy of the Daily Bugle , the famous New York newspaper where Peter Parker works .",SEN:7,e18v-201-7,LIT
A true - to - life,SEN:8,e18v-201-8,ORAL
"replica , full of cool little references to the Marvel / Spidey universe . Then",SEN:9,e18v-201-9,LIT
"there are two numbered goodies : a lithograph as well as an artbook presented as a comic book , in its protective plastic bag , ideal for collectors .",SEN:10,e18v-201-10,LIT
Mine was not opened . But,SEN:11,e18v-201-11,LIT
"I know that the artbook inside offers a whole series of visuals of the game , really very nice . We",SEN:12,e18v-201-12,LIT
"continue with a New York subway guide , which actually contains a small box with the code to download the game ( be careful , I downloaded the game , so it is in the box but not usable).There",SEN:13,e18v-201-13,LIT
"is also in this Press Kit , a map of Manhattan , and a mysterious document that seems straight out of a secret - defense",SEN:14,e18v-201-14,LIT
file . We,SEN:15,e18v-201-15,LIT
end up with a coffee - shop,SEN:16,e18v-201-16,LIT
coffee bean pocket quite in the mood of the game .,SEN:17,e18v-201-17,LIT
"It' s filled with cool little goodies , like a page torn from a Peter Parker notebook with logo tests for his suit , and sketched prototypes of his flamethrowers .",SEN:18,e18v-201-18,LIT
"There' s also a magnetic pin , a fabric patch , Peter Parker' s press card at the Daily Bugle , and a beautiful set of photos . En",SEN:19,e18v-201-19,LIT
"anglais , dossier de presse très rare , exclusif , 2018 , PS4Contenu très riche .",SEN:20,e18v-201-20,LIT
media press kit numéroté .,SEN:21,e18v-201-21,LIT
La boite est plus grande que celle données habituellement pour les dossiers de presse PlayStation .,SEN:22,e18v-201-22,LIT
"Blanche , elle arbore le symbole de l’ homme-araignée",SEN:23,e18v-201-23,LIT
"sur un fond argenté et texturé , comme une toile !",SEN:24,e18v-201-24,LIT
"En l’ ouvrant , on tombe sur un visuel incroyable de Spider - Man ,",SEN:25,e18v-201-25,LIT
et sur le contenu . Tout,SEN:26,e18v-201-26,LIT
"d’ abord , on trouve un exemplaire du Daily Bugle , le célèbre journal New-Yorkais",SEN:27,e18v-201-27,LIT
où travaille Peter Parker .,SEN:28,e18v-201-28,LIT
"Une réplique plus vraie que nature , truffée de petites références cool à l’ univers Marvel / Spidey . Ensuite ,",SEN:29,e18v-201-29,LIT
"on trouve deux goodies numérotés : une lithographie ainsi qu’ un artbook présenté façon comics , dans sa pochette plastique de protection , idéal pour les collectionneurs .",SEN:30,e18v-201-30,LIT
Le mien n' a pas été ouvert . Mais,SEN:31,e18v-201-31,LIT
"je sais que le artbook à l' intérieur propose toute une série de visuels du jeu , vraimenttrès sympa . On",SEN:32,e18v-201-32,LIT
"continue avec un guide du métro New-Yorkais ,",SEN:33,e18v-201-33,LIT
"qui contient en réalité un petit carton avec le code pour télécharger le jeu ( attention , j' ai téléchargé le jeu , donc il est dans la boîte mais non utilisable ) .On",SEN:34,e18v-201-34,LIT
"trouve également dans ce Press Kit , un plan de Manhattan , ainsi qu’ un mystérieux document qui semble tout droit sorti d’ un dossier secret - défense . On",SEN:35,e18v-201-35,LIT
finit par une pochette du coffee - shop,SEN:36,e18v-201-36,LIT
Coffee Bean tout à fait dans l’ ambiance du jeu .,SEN:37,e18v-201-37,LIT
"Elle est rempli de petits goodies sympas , comme une page arrachée d’ un cahier de Peter Parker avec des essais de logo pour son costume , et des prototypes crayonnés de ses lance - toiles .",SEN:38,e18v-201-38,LIT
"On y trouve également un pin’ s aimanté , un patch en tissu , la carte de presse de Peter Parker au Daily Bugle , ou encore un set de photos magnifiques .",SEN:39,e18v-201-39,LIT
A simplement servi 1/4h .,SEN:0,e18v-202-0,LIT
Étatvraimentneuf avec emballage et notice d' origine .,SEN:1,e18v-202-1,LIT
Je dispose d' un appareil similaire donc il est inutile pour moi .,SEN:2,e18v-202-2,LIT
"SUPERBE ENSEMBLE "" Hello Kitty "" 5 Ans ( étiquette coupée ) Bon état Vraiment très sympa",SEN:0,e18v-203-0,LIT
SUPERBE ROBE Taille : 38 Très bon état Il y a un smocks derrière ( phot N ° 4 ) ce qui permet de s' adapter à la morphologie Se noue derrière le cou .,SEN:0,e18v-204-0,LIT
Fait un magnifique décolleté .,SEN:1,e18v-204-1,LIT
"Vraiment sympa et coupe très originale Réduction possible , n' hésitez pas à me contacter",SEN:2,e18v-204-2,LIT
Apple MacBook Pro 17 ( mid-2010 ),SEN:0,e18v-205-0,LIT
AZERTY Intel Core i7 2.6GHz,SEN:1,e18v-205-1,ORAL
- 8GoRAM SSD 120 GO + 1TO Batterie NEUVE changée par pro .,SEN:2,e18v-205-2,LIT
"Octobre 2018 Grand écran 17 "" mate antireflet Bel aspect fonctionne parfaitement .",SEN:3,e18v-205-3,LIT
Livré avec un Graveur de DVD monté sur USB ( voir photo ) et transformateur Aucun problème avec cette machine dont l' aspect estvraimentbien Bonnes enchères .,SEN:4,e18v-205-4,LIT
Très ancienne enclume très lourde de poids et d’ époque inconnue mais environ 300kg-400 kg,SEN:0,e18v-206-0,LIT
"retrouver dans ma grange en Alsace Haut-Rhin ,",SEN:1,e18v-206-1,LIT
quand on regarde de très près on peut voir les vestiges de traçage celte sur la face avant .,SEN:2,e18v-206-2,LIT
"L’ enclume est vendu seul , rien d’ autre .",SEN:3,e18v-206-3,LIT
"j’ ai essayer de la soulever à trois personnes costauds et des sangles ainsi qu’ avec un chariot pouvant soutenir 350 kg visible sur les photos mais impossible de la soulever , j’ ai dû utiliser une girafe pour la changer dans le pickup .",SEN:4,e18v-206-4,LIT
"Dimension Longueur pointe à pointe 70 cm Hauteur 38 cm Épaisseur 25 cm L’ enclume est à venir récupérer sur place en Alsace Haut Rhin , aucune livraison ne sera faite .",SEN:5,e18v-206-5,LIT
D’ autre photos ou informations sur demande ! ! ! ! ! ! ! ! ! ! ! ATTENTION,SEN:6,e18v-206-6,LIT
ENCLUME VRAIMENT TRÈS LOURDE ! ! ! ! ! ! ! ! ! ! ! ! !,SEN:7,e18v-206-7,ORAL
Jeu fabriqué par DAMM vraiment peu courant datant des années 60 .,SEN:0,e18v-207-0,LIT
"Il se compose d' un grand plateau ( 77 x 38,5 cm ) de 24 voitures de course ( 4 par couleur ) et de 2 dés en bois .",SEN:1,e18v-207-1,LIT
Il parait complet au niveau des pièces mais il n' y a pas de notice .,SEN:2,e18v-207-2,LIT
Bon état général : voir photos Livraison internationale OK à convenir avant enchère avec l' acheteur Paiement par CHEQUE ou VIREMENT préféré Envoi soigné,SEN:3,e18v-207-3,LIT
MAGNIFIQUE RAS DU COU EN OR BLANC ET JAUNE .,SEN:0,e18v-208-0,LIT
FERMOIR DE SECURITE .,SEN:1,e18v-208-1,LIT
TRES BELLE FABRICATION .,SEN:2,e18v-208-2,LIT
"Le poids en or de ce collier a été estimé à plus de 650 euros , mais ce serait vraiment dommage de fondre ce bijou .",SEN:3,e18v-208-3,LIT
Je peux envoyer d' autres photos ou renseignements sur demande .,SEN:4,e18v-208-4,LIT
ENVOI COLISSIMO AVEC OPTION INDEMNISATION AD VALOREM .,SEN:5,e18v-208-5,LIT
PAIEMENT PAR VIREMENT PAYPAL UNIQUEMENT Prix : 1150 euros Bonnes enchères à tous .,SEN:6,e18v-208-6,LIT
"Très originale , détails fantaisie Broderies , perles , effet jupon , plissée , couture ...",SEN:0,e18v-209-0,LIT
"Vraiment superbe et en très bon état Taille 40 , sans étiquette , vérifiez les mesures ci-dessous",SEN:1,e18v-209-1,LIT
"largeur taille environ 40 cm , longueurenviron 47 cm Frais de port recalculés si plusieurs achats Faites vous plaisir , enchérissez",SEN:2,e18v-209-2,LIT
"Je vends ces sublimes boots de la marque San Marina Modèle bimatière en cuir et daim noir Boucle en cuir argenté sur le côté Très rock , elles iront aussi bien avec une robe et un perfecto qu' avec un jean et un manteau classe .",SEN:0,e18v-210-0,LIT
Elles sont en parfait état : une mini éraflure à l' arrière de l' un des talons mais il faut vraiment mettre le nez dessus pour la voir .,SEN:1,e18v-210-1,LIT
Pointure indiquée 35 mais je fais un 36 et elles me vont Prix d' achat 139 euros .,SEN:2,e18v-210-2,LIT
Possibilité de remise en main propre sur Paris,SEN:3,e18v-210-3,LIT
Bonjour .,SEN:0,e18v-211-0,LIT
"A vendre Très belle paire de chaussure Marque "" mephisto "" Pour femme Taille 40 aucunes usures Elles sont vraiment comme neuve .",SEN:1,e18v-211-1,LIT
Air relax,SEN:2,e18v-211-2,ORAL
"Caisse de 6 fermée et cerclée conservée en cave , parfait état .",SEN:0,e18v-212-0,LIT
Duhart - Milon,SEN:1,e18v-212-1,ORAL
est un pauillac classique .,SEN:2,e18v-212-2,LIT
Il allie à merveille la concentration à une immense distinction .,SEN:3,e18v-212-3,LIT
"La bouche est droite , racée et développe en finale des notes d' épices .",SEN:4,e18v-212-4,LIT
"La touche "" Lafite "" est vraiment perceptible .",SEN:5,e18v-212-5,LIT
C' est un vin qui nécessite une garde de plusieurs années afin de déployer toute sa complexité aromatique .,SEN:6,e18v-212-6,LIT
Les meilleurs millésimes de Château Duhart - Milon,SEN:7,e18v-212-7,LIT
": 2010 , 2009 , 2006 , 2005 , 2004 , 2003 , 2002 , 2001 , 2000 , 1998 , 1996 , 1990 , 1989 , 1988 , 1983 , 1982 , 1961 , 1959 , 1953 , 1949 , 1947 , 1945",SEN:8,e18v-212-8,LIT
"Pour cause de "" prise de volume "" je rentre difficilement dans cette belle veste Givenchy T50 100 % laine vierge . Le",SEN:0,e18v-213-0,LIT
tissu est superbe .,SEN:1,e18v-213-1,LIT
"Dommage , elle tombe vraiment bien .",SEN:2,e18v-213-2,LIT
Elle est vraiment très agréable à porter .,SEN:3,e18v-213-3,LIT
"À NOTER 1 : petit trou sur le devant de la manche gauche que vous pouvez voir sur la première photo ( 2 mm de diamètre ) À NOTER 2 : c' est une veste que j' ai pas mal portée À NOTER 3 : ne tenez pas compte des traces blanches ( poussières car j' étais en plein "" ménage de printemps "" )",SEN:4,e18v-213-4,LIT
Très beau Couteau de poche en bois de Cerf de fabrication artisanale .,SEN:0,e18v-214-0,LIT
Lame Opinel carbone n° 8 Dragonne cuir Vraiment unique Lame carbone guillochée main Virole de blocage double Bonne prise en main Cadeau idéal pour chasseur ou autres Ferme 17 cm Lame .,SEN:1,e18v-214-1,LIT
"8 cm Tous mes modèles sont uniques Idéal pour tous loisirs , chasse , pêche , champignons .",SEN:2,e18v-214-2,LIT
Merci aux visiteurs de cette annonce .,SEN:3,e18v-214-3,LIT
Si vous avez des questions n' hésitez pas à me contacter .,SEN:4,e18v-214-4,LIT
Bonne chance ! ! !,SEN:5,e18v-214-5,ORAL
Et bonnes enchères à tous ! ! !,SEN:6,e18v-214-6,LIT
Très jolie jupe longue esprit bohème romantique avec plein de petits détails ...,SEN:0,e18v-215-0,LIT
portée elle est vraiment sublime ..,SEN:1,e18v-215-1,LIT
"vendu démonté car inventaire il est complet apres inventaire mais possible qu' il y ai des petites erreur mais rien de grave qq arrangements de couleur et peut etre 2/3 autre mais rien de visible vendu avec ses 3 notices en etat correct piecves en bon état mais nécessite un depoussierage n' hesitez pas pour les questions , reponse rapide !",SEN:0,e18v-216-0,LIT
paiement paypal largement préféré cheque : expé apres encaissement remise en main propre possible livraison mondial relais : c' est vraiment mieux et moins cher que la poste mais colissimo possible sur demande pas de retours,SEN:1,e18v-216-1,LIT
"dimensions : L 80 x l 75 x H 86,5 cmécart entre les barreaux : 1,5 cmLa cage pour furet Furet XL offre à votre compagnon une grande maison parfaite .",SEN:0,e18v-217-0,LIT
La forme rectangulaire et généreuse de la cage sur deux étages donne beaucoup de place au furet ou autre rongeur ( perso j' avais des ratounes ! ) .,SEN:1,e18v-217-1,LIT
La grille à traverses s' enlève facilement du bac en plastique .,SEN:2,e18v-217-2,LIT
Ainsi vous pouvez enlever les bacs pour un nettoyage facile et rapide .,SEN:3,e18v-217-3,LIT
La grille se fixe aux bacs en plastique avec 2 crochets sur chaque coin de la cage et est sécurisée de l' intérieur grâce à des dents en plastique légèrement rebiquées qui l' empêchent de glisser .,SEN:4,e18v-217-4,LIT
Les haubans angulaires de la grille sont renforcés pour une bonne stabilité de la cage . À,SEN:5,e18v-217-5,LIT
l' avant de la cage se trouve une contre-porte,SEN:6,e18v-217-6,LIT
qui vous facilite l' entrée et la sortie de votre rongeur .,SEN:7,e18v-217-7,LIT
"De plus , il y a une autre contre-porte",SEN:8,e18v-217-8,LIT
sur le haut de la cage .,SEN:9,e18v-217-9,LIT
Ainsi vous disposez de beaucoup de place pour aménager la cage . J' ai,SEN:10,e18v-217-10,LIT
"fait un "" trou de raccordement "" pour relier deux cages à l' aide d' un tuyau ( voir photo ) .",SEN:11,e18v-217-11,LIT
"Il est "" rebouché "" et sécurisé grâce à une plaque d' aération donc pas d' inquiétude La cage n' est pas toute neuve , certains barreaux sont rouillés mais elle est vraiment top car elle se démonte totalement donc ne prend pas de place et se lave facilement dans la baignoire / douche",SEN:12,e18v-217-12,LIT
Vous enchérissez sur la dinky toys réf.24J,SEN:0,e18v-218-0,LIT
"bleu turqoise "" neuf "" et meme MINT , en boite d' origine "" a "" , rare , en 1962 , un enfant la voulait rouge comme les Ferrari donc difficile à trouver dans cet couleur turquoise et état "" concours "" , La peinture est brillante , sans rayure ni tete d' épingle , les glaces transparentes et sans rayure , l' argenture est parfaite , jantes chromées sans la moindre trace de rouille avec pneus noirs d' origine encore souple , elle est restè en boite à l' envers , ( les pro comprendront ) , Le chassis noir brillant est comme le reste , superbe !",SEN:1,e18v-218-1,LIT
"sans manque ni rayure , lot comme au premier jour Regardez bien les 10 photos soignées , elles font parties du descriptif et parlent d' elles memes , J' offre le retour si vous n' étiez pas entièrement satisfait , une remise en mains propres est envisageable , me contacter pour les frais , je suis dans le 92 La boite superbe , belles couleurs , rigide , tous ces flaps et retour , angles parfaits , vraiment "" a "" pas d' écriture ni de scotch , ni déchirure , 58 ans de vitrine , prix justifié , n' hésitez pas à me poser des questions , j' y répondrait dans la journée , Livraison colissimo recommandé avec signature et assurance , me consulter pour l' internationale , Paiement exclusivement par chèque en France , merci de votre compréhension , Bonne enchère !",SEN:2,e18v-218-2,LIT
1 ROBE LONGUE EN VELOURS NOIR ET SON BUSTIER ACCROCHE EN MAILLE ARGENTE SANS MANCHETAILLE 48 50POLYESTER ET ELASTANE TRES BELLE QUALITE HAUTEUR DE LA ROBE 130 CM ETAT IMPECABLEROBE PORTE UN SEULE FOIS A UN MARIAGE VRAIMENT UNE AFFAIRE,SEN:0,e18v-219-0,LIT
"Marque : FREE LANCEPrix d' origine : 420 eurosBottines boots santiagsFermeture éclair côté intérieurCuir veauTout cuirPointure : 41 - Pour celles qui ne connaisssent pas cette marque , Free Lance chausse plutôt grand et plutôt étroit : pieds , chevilles et jambes fins mais celles-ci",SEN:0,e18v-220-0,LIT
chaussent vraiment 41 car étroites au bout !,SEN:1,e18v-220-1,LIT
les plis sur le cuir au niveau de la cheville sont normaux car cuir très souple ( veau glacé ) Coloris & composition : Coloris : NoirDessus : Cuir lisseIntérieur : Doublé cuirSous - pied,SEN:2,e18v-220-2,LIT
: Cuir Mesures : Hauteur du talon à l' arrière : 4.3,SEN:3,e18v-220-3,LIT
"cmHauteur totale , talon compris : 20.5",SEN:4,e18v-220-4,LIT
cmTour au niveau de la cheville : 28 cm profils 0 me contacter merci,SEN:5,e18v-220-5,LIT
"Vends coffret Jurassic Park Trilogie Steelbook Collection ( édition taïwanaise incluant 6 cartes postales petit format sur papier glacé ) + goodies de l' édition HDzeta ( 12 cartes postales , un dépliant et une carte numérotée ) ainsi que l' édition steelbook HDzeta de Jurassic World .",SEN:0,e18v-221-0,LIT
L' ensemble est en excellent état .,SEN:1,e18v-221-1,LIT
"A noter toutefois , une légère marque en bas du recto ( photo 7 ) et je pense un défaut de peinture à droite ( photo 8) sur le recto du steelbook de Jurassic Park III .",SEN:2,e18v-221-2,LIT
Ces défauts sont vraiment minimes et quasiment invisible mais je préfère le préciser pour les collectionneurs les plus pointilleux .,SEN:3,e18v-221-3,LIT
BOITE COFFRET CAPODIMONTE XIX EME NAPOLEON REVOLUTION DIAMETRE 12 CM HAUTEUR 9 CM EXCELLENT ETAT SAUF UN MINUSCULE CHEVEU SUR COUVERCLE MAIS VRAIMENT RIEN,SEN:0,e18v-222-0,ORAL
Coffret comme neuf .,SEN:0,e18v-223-0,LIT
"Je suis quelqu' un de très soigneux , il est vraiment dans un état impeccable .",SEN:1,e18v-223-1,LIT
Envoi rapide dans un colis adapté pour ne pas qu' il s' abîme pendant le transport .,SEN:2,e18v-223-2,LIT
"COMPREND LES 6 ALBUMS STUDIO DE GEORGE HARRISON POUR CETTE PERIODE : 1 ) THIRTY THREE & 1/3 2 ) GEORGE HARRISON 3 ) SOMEWHERE IN ENGLAND 4 ) GONE TROPPO 5 ) CLOUD NINE PLUS LE DOUBLE SACD "" LIVE IN JAPAN "" PLUS 1 DVD "" DARK HORSE YEARS "" AVEC CLIPS , LIVE ...",SEN:3,e18v-223-3,LIT
"CM2 LOTS DE 20 VEHICULES DE POMPIERS SOLIDO HACHETTE TOUS LES CAMIONS SONT EN PARFAIT ETAT AUCUNE RAYURE , MANQUE DE PEINTURE OU AUTRES .. ETAT",SEN:0,e18v-224-0,LIT
NEUF BOITES PRESANTANT DE L USURE D ETAT D USAGE SEUL ET VOIR PHOTO 12 UN MICRO MANQUE DE PEINTURE AU NIVEAU DU DESSOUS DU PARBRISE SUR LA JEEP VRAIMENT RIEN DE GRAVE EMBALLAGE PARFAIT JE REGOUPE LES ACHATS POUR ENVOI,SEN:1,e18v-224-1,ORAL
"Bonjour , L' appareil fonctionne très bien et est en très bon état , je l' ai très peu utilisé .",SEN:0,e18v-225-0,LIT
Son look est vraiment extra !,SEN:1,e18v-225-1,LIT
"Je le vends ave un objectif , un étui , deux batteries , ses câbles et chargeurs .",SEN:2,e18v-225-2,LIT
Ses principales caractéristiques : Compacité record !,SEN:3,e18v-225-3,LIT
Réactivité de l' autofocus .,SEN:4,e18v-225-4,LIT
Écran tactile .,SEN:5,e18v-225-5,LIT
Déclenchement totalement silencieux .,SEN:6,e18v-225-6,LIT
Bonne gestion du bruit électronique .,SEN:7,e18v-225-7,LIT
12 - 32 mm de bonne facture .,SEN:8,e18v-225-8,LIT
Flash intégré .,SEN:9,e18v-225-9,LIT
Mode vidéo complet .,SEN:10,e18v-225-10,LIT
Connexion Wi - Fi,SEN:11,e18v-225-11,ORAL
Ps : je tiens à préciser que la vente de cet appareil ne s' est fait avec le dernier acheteur ( cf mon profil d' évaluation ) pour une raison indépendante de ma volonté .,SEN:12,e18v-225-12,LIT
En vous remerciant .,SEN:13,e18v-225-13,LIT
RARE REEL PAIRE DE PETIT BOUGEOIR D HOTEL 19 EME EN BRONZE ATTENTION DECORD DES STRIAGES DIFFERENT ET POURTANT PROVIENT DU MEME HOTEL HAUTEUR 10 CM DIAMETRE AU CUL 45 MM UNE TRES LEGERE DEFORMATION SUR L EMBASE DE L UN D EUX vraiment rien de grave,SEN:0,e18v-226-0,LIT
"Gigoteuse Ouatiné , TOG 2 ' Collection Etoiles ' Blanc / Etoiles Grises RED CASTLE Modèle version ouatinée : TOG 2 .",SEN:0,e18v-227-0,LIT
En tissu gaufré ouatiné toute douce Taille 65 cm / Fente pour le passage de la sangle entre-jambes,SEN:1,e18v-227-1,LIT
du siège - auto .,SEN:2,e18v-227-2,LIT
"Le petit prix est dû , une petite tâche sur le col voir photo , vraiment très petite et discrète , ainsi qu' une autre vraiment peu visible au milieu sur le devant , voir photo aussi Sinon , elle est en excellent état .",SEN:3,e18v-227-3,LIT
"L' intérieur est très propre , aucunes tâches !",SEN:4,e18v-227-4,LIT
* * * * *,SEN:5,e18v-227-5,ORAL
"Je vends la couverture / couette , même collection Etoile RED CASTLE dans une autre annonce * * * *",SEN:6,e18v-227-6,LIT
Merci de lire jusqu’ au bout Je vide mes placards .,SEN:7,e18v-227-7,LIT
( Occasion ou Neuf ) .,SEN:8,e18v-227-8,LIT
Si vous le souhaitez il y a de quoi faire des lots intéressants en regroupant les achats pour les frais de port .,SEN:9,e18v-227-9,LIT
"Enfant : Vêtements , accessoires et chaussures allant de la Naissance à la taille 6 ans .",SEN:10,e18v-227-10,LIT
( voir les marques ci dessous ) Servis à un seul enfant Vêtements et chaussures adultes ( voir marques ci dessous ) Maison non-fumeur .,SEN:11,e18v-227-11,LIT
Les habits que je vends sont propres mais non repassés ( lavés avec de la lessive bio Pas de sèche linge utilisé ( donc habits non rétrécis et couleur non passée ) .,SEN:12,e18v-227-12,LIT
"Si il y a des traces d’ usures ou des trous , je les décris dans l’ annonce et essaye de les montrer au mieux sur les photos .",SEN:13,e18v-227-13,LIT
"Bébé / enfant : Abercrombie kids , Absorba , Blabla Kids , Bout’ chou , Cocoon , Cyrillus , H&M , IKKS , La Queue du chat , Marks spencer , Monoprix Kids , Petit bateau , Sergent Major , Red Castle , Tapes à l’ œil Chaussures Enfant : Timberland , Bobux , Babybotte , Easy Peasy Adulte : American Apparel , American Eagle , Adidas , Armani , Benetton , Carhartt , Comptoir des cotonniers , Diabless , Diesel , French Connection , Eres , la Fée maraboutée , Gap , G - star , Kanabeach , Kookai , Majestic Filatures , Max Mara , Princesse Tam tam , Sandro , Sooruz , Volcom , Zara Chaussures : Adidas , Converse , Nike , Nine West , Spring court , Stéphane Kélian Merci d' avoir regardé",SEN:14,e18v-227-14,LIT
MAGNIFIQUE MANTEAU DE RENARD D ELEVAGE PLEINES PEAUX ARGENTE ARGENTE c est vraiment une beauté cette fourrure TAILLE 44 46 achat Montréal grand fourreur de MONTREAL LON DU MANTEAU 120CM voir les photos colis poste avec assurances bonnes enchères,SEN:0,e18v-228-0,LIT
Manque juste 2 strass ( seconde photo ) mais ne se voit vraiment pas .,SEN:0,e18v-229-0,LIT
Vendu dans sa boîte d’ origine,SEN:1,e18v-229-1,LIT
Je vends ce pantalon en jeans .,SEN:0,e18v-230-0,LIT
Marque g star Taille w25 l32 soit 36 .,SEN:1,e18v-230-1,LIT
Coupe slim ( entre slim et droit ) Coutures tournantes .,SEN:2,e18v-230-2,LIT
Couleur bleu clair .,SEN:3,e18v-230-3,LIT
Je le vends à regret car trop grand ( il n’ est pas vraiment mis en valeur sur les photos ! ),SEN:4,e18v-230-4,LIT
Tres bon état .,SEN:5,e18v-230-5,LIT
"Appareil compact FUJIFILM en excellent état avec unebatterie supplémentaire , la sacoche , une carte mémoire de 4 GB offerts et lemanuel complet et précis en format PDF + le manuel simplifié en format papier + emballage d' origine .",SEN:0,e18v-231-0,LIT
"Je ne peux pas mettre sur cette annonce toutes les fonctionscar , les possibilités sont vraiment multiples .",SEN:1,e18v-231-1,LIT
Batterie Li - ion,SEN:2,e18v-231-2,ORAL
"NP-50 , chargeur de batterie BC-45W , dragonne , câble A / V , USB Description de l’ appareil ci-dessous",SEN:3,e18v-231-3,LIT
: Capteur Super CCD EXR 12 mégapixels Zoom optique 15x Grand-angle,SEN:4,e18v-231-4,LIT
"24 mm Écran LCD 3 "" 460 000 pixels Panoramique en mouvement à 360 ° Flash Super Intelligent Mode Pro Focus amélioré Modes d' exposition P / A / S / M Photos Full HD et Vidéo HD 720p , visualisation via un portmini HDMI .",SEN:5,e18v-231-5,LIT
Pour renseignements me contacter .,SEN:6,e18v-231-6,LIT
"Salut les zikos , une nouvelle pelle me fait de l’ oeil et du coup je fais un peu de place dans ma collection . Voici",SEN:0,e18v-232-0,LIT
une BC Rich USA vintage de 1992 ; l’ époque dorée où la marque ne sortait que des chef d’ oeuvres et avait une super réputation qui malheureusement s’ est ternie par la suite après leurs dérives asiatiques douteuses . La,SEN:1,e18v-232-1,LIT
belle sort tout droit de l’ Usine de Californie comme l’ atteste la plaque arrière et le logo sur la tête . Le,SEN:2,e18v-232-2,LIT
"corps est en acajou , le manche de 22 frettes est en érable et dispose d’ une assez rare touche en palissandre clair ce qui donne un très joli contraste avec le corps noir brillant .",SEN:3,e18v-232-3,LIT
Les mécaniques sont des Gotoh . J’ ai,SEN:4,e18v-232-4,LIT
"changé les micros d’ origine ( kent armstrong usa ) pour des micros du prestigieux luthier français expatrié aux USA , j’ ai nommé l’ excellent José Dominger qui a affublé cette merveille de son kit custom War Scars Desert Falcon dont voici les caractéristiques : Un Gain énorme , un son organique , du grain de la définition , le jeu ’ au potard ’ prends tout son sens car le potentiel du micro bridge est énorme de versatilité , de dynamique et de précision ...",SEN:5,e18v-232-5,LIT
Couplé au micro neck ( Raw ) ce set offre tout ce dont on rêve que ce soit en double ou en mode splitté ! Un,SEN:6,e18v-232-6,LIT
"son ’ clean ’ incroyable en split - coil ,",SEN:7,e18v-232-7,LIT
et en position centrale ( 2 micros ) on jurerait avoir des piézos .. Extrêmement,SEN:8,e18v-232-8,LIT
polyvalent ce set Metal vous emmenera de la Country ( splitt ) au Djent - Metal,SEN:9,e18v-232-9,LIT
sans y perdre son âme de Killer ! !,SEN:10,e18v-232-10,LIT
Ce set est régulièrement monté par Mayones sur Setius - Regius - Duvell :,SEN:11,e18v-232-11,LIT
Bridge ( 19.5,SEN:12,e18v-232-12,LIT
- 20 K ) Neck ( 13.5,SEN:13,e18v-232-13,LIT
- 14 K ) La belle dispose également d’ un floyd rose sous licence que je n’ ai pratiquement jamais utilisé . Elle,SEN:14,e18v-232-14,LIT
est vendue dans son étui dur vintage BC Rich conçu pour supporter ses formes extrêmes . Cette,SEN:15,e18v-232-15,LIT
"gratte est dans un excellent état pour ses 26 ans , elle a quelques menus pocs notamment sur les cornes mais vraiment infimes comparés aux blessures habituelles sur ce genre de gratte aux angles agressifs . Paiement",SEN:16,e18v-232-16,LIT
par Paypal ou virement bancaire . Cheers,SEN:17,e18v-232-17,LIT
Robinet mitigeur haut de gamme Couleur Nickel Brossé Modèle du célèbre designer Massimiliano Della Monaca Marque NEWFORM modèle MORPHO Excellent état esthétique et de fonctionnement Vraiment magnifique,SEN:0,e18v-233-0,LIT
"Bien porté , jolie coupe droite .",SEN:0,e18v-234-0,LIT
