"in English , very rare press kit , exclusive , 2018 , PS4Very rich content .",SEN:0,e18v-201-0,LIT
media press kit numbered . The,SEN:1,e18v-201-1,LIT
box is larger than that usually given for PlayStation press kits .,SEN:2,e18v-201-2,LIT
"White , she wears the symbol of the spider - man",SEN:3,e18v-201-3,LIT
"on a silver and textured background , like a canvas !",SEN:4,e18v-201-4,LIT
"By opening it , we come across an amazing visual of Spider - Man ,",SEN:5,e18v-201-5,LIT
"and on the content . First ,",SEN:6,e18v-201-6,LIT
"there is a copy of the Daily Bugle , the famous New York newspaper where Peter Parker works .",SEN:7,e18v-201-7,LIT
A true - to - life,SEN:8,e18v-201-8,ORAL
"replica , full of cool little references to the Marvel / Spidey universe . Then",SEN:9,e18v-201-9,LIT
"there are two numbered goodies : a lithograph as well as an artbook presented as a comic book , in its protective plastic bag , ideal for collectors .",SEN:10,e18v-201-10,LIT
Mine was not opened . But,SEN:11,e18v-201-11,LIT
"I know that the artbook inside offers a whole series of visuals of the game , really very nice . We",SEN:12,e18v-201-12,LIT
"continue with a New York subway guide , which actually contains a small box with the code to download the game ( be careful , I downloaded the game , so it is in the box but not usable).There",SEN:13,e18v-201-13,LIT
"is also in this Press Kit , a map of Manhattan , and a mysterious document that seems straight out of a secret - defense",SEN:14,e18v-201-14,LIT
file . We,SEN:15,e18v-201-15,LIT
end up with a coffee - shop,SEN:16,e18v-201-16,LIT
coffee bean pocket quite in the mood of the game .,SEN:17,e18v-201-17,LIT
"It' s filled with cool little goodies , like a page torn from a Peter Parker notebook with logo tests for his suit , and sketched prototypes of his flamethrowers .",SEN:18,e18v-201-18,LIT
"There' s also a magnetic pin , a fabric patch , Peter Parker' s press card at the Daily Bugle , and a beautiful set of photos . En",SEN:19,e18v-201-19,LIT
"anglais , dossier de presse très rare , exclusif , 2018 , PS4Contenu très riche .",SEN:20,e18v-201-20,LIT
media press kit numéroté .,SEN:21,e18v-201-21,LIT
La boite est plus grande que celle données habituellement pour les dossiers de presse PlayStation .,SEN:22,e18v-201-22,LIT
"Blanche , elle arbore le symbole de l’ homme-araignée",SEN:23,e18v-201-23,LIT
"sur un fond argenté et texturé , comme une toile !",SEN:24,e18v-201-24,LIT
"En l’ ouvrant , on tombe sur un visuel incroyable de Spider - Man ,",SEN:25,e18v-201-25,LIT
et sur le contenu . Tout,SEN:26,e18v-201-26,LIT
"d’ abord , on trouve un exemplaire du Daily Bugle , le célèbre journal New-Yorkais",SEN:27,e18v-201-27,LIT
où travaille Peter Parker .,SEN:28,e18v-201-28,LIT
"Une réplique plus vraie que nature , truffée de petites références cool à l’ univers Marvel / Spidey . Ensuite ,",SEN:29,e18v-201-29,LIT
"on trouve deux goodies numérotés : une lithographie ainsi qu’ un artbook présenté façon comics , dans sa pochette plastique de protection , idéal pour les collectionneurs .",SEN:30,e18v-201-30,LIT
Le mien n' a pas été ouvert . Mais,SEN:31,e18v-201-31,LIT
"je sais que le artbook à l' intérieur propose toute une série de visuels du jeu , vraimenttrès sympa . On",SEN:32,e18v-201-32,LIT
"continue avec un guide du métro New-Yorkais ,",SEN:33,e18v-201-33,LIT
"qui contient en réalité un petit carton avec le code pour télécharger le jeu ( attention , j' ai téléchargé le jeu , donc il est dans la boîte mais non utilisable ) .On",SEN:34,e18v-201-34,LIT
"trouve également dans ce Press Kit , un plan de Manhattan , ainsi qu’ un mystérieux document qui semble tout droit sorti d’ un dossier secret - défense . On",SEN:35,e18v-201-35,LIT
finit par une pochette du coffee - shop,SEN:36,e18v-201-36,LIT
Coffee Bean tout à fait dans l’ ambiance du jeu .,SEN:37,e18v-201-37,LIT
"Elle est rempli de petits goodies sympas , comme une page arrachée d’ un cahier de Peter Parker avec des essais de logo pour son costume , et des prototypes crayonnés de ses lance - toiles .",SEN:38,e18v-201-38,LIT
"On y trouve également un pin’ s aimanté , un patch en tissu , la carte de presse de Peter Parker au Daily Bugle , ou encore un set de photos magnifiques .",SEN:39,e18v-201-39,LIT
A simplement servi 1/4h .,SEN:0,e18v-202-0,LIT
Étatvraimentneuf avec emballage et notice d' origine .,SEN:1,e18v-202-1,LIT
Je dispose d' un appareil similaire donc il est inutile pour moi .,SEN:2,e18v-202-2,LIT
