carte mère Optiplex GX620 avec Pentium 4 ht radiateur et ventilateur avec 2Go DDR2 avec Graveur Pro et carte graphique et carte modem .,SEN:0,e17p-201-0,LIT
pas alimentation si voulez la tour je vous la passe,SEN:1,e17p-201-1,LIT
"pc Lenovo tout en 1 comme neuf clavier , souris sans fil et télécommande disque dur 500go taille de écran 51 cm pour le reste regarde les photos si vous avez des questions hésite pas a me contacter merci bonne enchères",SEN:0,e17p-202-0,LIT
iMac 24 non funzionante vendo per parti di ricambio .,SEN:0,e17p-203-0,ORAL
Buona asta a tutti ! !,SEN:1,e17p-203-1,LIT
"Vend lot complet : Lenovo H530S : Processeur : Intel Core i3 - 4130 , Mémoire : 6 Go , Stockage : 1 To Graveur DVD + /- RW Type de produit Tour Processeur Intel Core i3 Système d' exploitation Microsoft Windows 10 Mémoire RAM 6 Go Type de mémoire vive installée DDR3 Capacité de stockage 1 To Type de disque dur SATA Vitesse de rotation du disque dur 7200 T / min Lecteur / Graveur Graveur DVD + /- RW Carte graphique AMD R5 235 Mémoire vidéo dédiée 1024 Mo Connectique 1 Ethernet RJ-45 1 VGA 6 USB 2.0",SEN:0,e17p-204-0,LIT
Philips 223V5LSB Ecran 21.5 '',SEN:1,e17p-204-1,ORAL
full hd Clavier azerty LENOVO Souris simple tout les produits du lot sont officiel .,SEN:2,e17p-204-2,LIT
"L' ordinateur tourne très bien pour une utilisation simple , il est en parfait état et est prêt a l' emploi .",SEN:3,e17p-204-3,LIT
Plus de photos disponibles si besoin .,SEN:4,e17p-204-4,LIT
Cordialement .,SEN:5,e17p-204-5,ORAL
Dans son emballage d' origine .,SEN:0,e17p-205-0,LIT
"Adorable tirelire ours , en forme d' argent , taille 22 cm .... bonnes",SEN:0,e17p-206-0,LIT
enchères .,SEN:1,e17p-206-1,LIT
Plaid polaire avec son Sac de transport pour enfants .,SEN:0,e17p-207-0,LIT
Motif voiture ..,SEN:1,e17p-207-1,ORAL
Lot en bon état .,SEN:2,e17p-207-2,LIT
Envoi rapide et soigner .,SEN:3,e17p-207-3,LIT
Visitez ma boutique !,SEN:4,e17p-207-4,ORAL
"Réveil Géant Enfant Décor Camion - Fonctionne Hauteur : 30 cm - Diamètre : 21,5 cm Envoi rapide et soigné",SEN:0,e17p-208-0,LIT
"Lot de 2 coussins # # schtroumpfette # # Résultat de recherche d' images pour "" cadeau pour noel enfant "" Coton - 40 x 40 cm - lavable et repassable .",SEN:0,e17p-209-0,LIT
Couleur Rose vif Les 2 coussins en très bon état sont identiques .,SEN:1,e17p-209-1,LIT
Emballage soigné et envoi rapide .,SEN:2,e17p-209-2,LIT
"Vend Serviette de Plage neuve dan son emballage d' origine au motif "" Princesses Disney "" , la serviette se transforme en petit sac à dos",SEN:0,e17p-210-0,LIT
Abat-jour,SEN:0,e17p-211-0,ORAL
hexagonal rose 3 faces avec illustrations romantiques enfantines Hauteur : 18 cm .,SEN:1,e17p-211-1,LIT
Diamètre en haut : 12 cm .,SEN:2,e17p-211-2,LIT
Mesures à la base : 40 cm .,SEN:3,e17p-211-3,LIT
Mesure entre 2 angles : 45 cm .,SEN:4,e17p-211-4,LIT
"Structure métallique , intérieur plastifié , extérieur sans doute en soie .",SEN:5,e17p-211-5,LIT
"Sur une face extérieure , une trace de peinture blanche à retirer avec douceur ; sur une autre face , une tâche fondue dans le dessin .",SEN:6,e17p-211-6,LIT
Cet abat-jour,SEN:7,e17p-211-7,LIT
"éclairait une chambre d' enfants spacieuse ; au plafond , il offrait une lumière douce et suffisante pour égayer le sol couvert de jouets et trésors divers des petits .",SEN:8,e17p-211-8,LIT
Une des faces du plastique intérieur présente une marque .,SEN:9,e17p-211-9,LIT
"Autres photos disponibles par mail , je vous les enverrai avec plaisir .",SEN:10,e17p-211-10,LIT
"Paiement en espèces , virement bancaire , timbres poste acceptés ; PAYPAL accepté pour achats groupés montant 20 Euros .",SEN:11,e17p-211-11,LIT
COUSSIN DE SOL ENFANT dimensions 30 x 33 cm environ Décoration chambre ou salle de jeux enfant 101 DALMATIENS Fabriqué par mes soins pour ma fille qui a grandit J' ai 3 coussins sensiblement identiques ( l' annonce est pour 1 coussin ),SEN:0,e17p-212-0,LIT
housse de couette pour lit une personne,SEN:0,e17p-213-0,LIT
"Panière blanche avec peluche éléphant gris Très bon état comme neuve Regardez mes autres ventes , je recalcule les frais de livraison par mondial relay .",SEN:0,e17p-214-0,LIT
"Si pas d' indication sur le mondial relay que vous souhaitez au moment du paiement , je choisi celui indiqué par le site Envoi colisimo possible , me contacter.merci",SEN:1,e17p-214-1,LIT
"CAPE DE BAIN EPONGE BLANCHE SERGENT MAJOR 70X70CM , pointe à impression jouets",SEN:0,e17p-215-0,LIT
etagere enfant PAIEMENT sous 5 jours maxi mondial relay 8 euro retrait possible je ne suis en aucun cas responsable des dysfonctionnements de la poste pensez a regrouper vos achat Consultez mes autres objets !,SEN:0,e17p-216-0,LIT
"FRISE DECORATION MURALE PRINCESSES DISNEY Longueur 5 mètres Largeur 10,5 cm Adhésive",SEN:0,e17p-217-0,LIT
Horloge murale Reine des neiges Neuve,SEN:0,e17p-218-0,LIT
Magnifique Boule à neige CHANEL DIAMÈTRE 12 cm . Dans,SEN:0,e17p-219-0,LIT
sa boîte d' origine . Rare !,SEN:1,e17p-219-1,LIT
"Environ 12 cm de hauteur emballage cadeau neuve , Magnifique cadeau a offrir NEUVE VIP cadeau neuf ! !",SEN:2,e17p-219-2,LIT
"non disponible dans les magasins Vendu avec sa boite Chanel d origine+sac shopping Chanel + son camélia , son ruban , son papier de soie",SEN:3,e17p-219-3,LIT
Parure 3 stylos ( plume - bille - porte,SEN:0,e17p-220-0,LIT
"mine ) WATERMAN "" IDEAL "" LE MAN 100 Documents et accessoires fournis : 1 Boite-",SEN:1,e17p-220-1,LIT
Sur-boite,SEN:2,e17p-220-2,ORAL
- 6 cartouches encre bleue - cartouche à piston - Livret - Garanties - Certificats d' origine Caractéristiques Corps et capuchon résine noire - Attributs plaqués or Plume : or jaune bicolore 18 carats - Mécanisme à cartouche Bille : mécanisme sortie bille par quart de tour Mine : Diamètre mine 0.7 mm,SEN:3,e17p-220-3,LIT
- sortie de mine par quart de tour - petite gomme sous le capuchon L' ensemble à l' état neuf utilisé,SEN:4,e17p-220-4,LIT
Coffret de 4 monnaies et plaque gravée des 25 ans du Parc 500 exemplaires uniquement .,SEN:0,e17p-221-0,LIT
Avec certificat d' authenticité Ouvert juste pour la photo,SEN:1,e17p-221-1,LIT
"Eupholus humeralis Heller , 1908 trés bel exemplaire male , qualité exceptionnelle , difficile à trouver actuellement ; Exemplaire expédié dépiqué , packaging spécial pour éviter tout dommage .",SEN:0,e17p-222-0,LIT
"Eupholus humeralis Heller , 1908 male specimen , exceptional mint quality , difficult to find at present and sent unpinned in a special packaging .",SEN:1,e17p-222-1,LIT
C.Chrysotribax,SEN:0,e17p-223-0,ORAL
hispanus f.latissimus,SEN:1,e17p-223-1,ORAL
A1,SEN:2,e17p-223-2,ORAL
"Belle brochure sur les automobiles Gabriel VOISIN , les 8 , 10 , 14 , 18 , et 24 cv .",SEN:0,e17p-224-0,LIT
"Très bon état , 72 pages + 4 dépliants .",SEN:1,e17p-224-1,LIT
"ancienne écumoire en cuivre faite en une seule pièce , les photos sont le descriptif .",SEN:0,e17p-225-0,LIT
Très bel objet de collection .,SEN:1,e17p-225-1,LIT
"longueur 47 cm , poids 500 g",SEN:2,e17p-225-2,LIT
"T - shirt et casquette édités pour les jeux olympiques de Berlin , pour l' année 2000 .",SEN:0,e17p-226-0,LIT
"L' Allemagne était alors persuadée d' avoir les jeux , ils ont été attribués à Sydney ...",SEN:1,e17p-226-1,LIT
"Neuf , t - shirt",SEN:2,e17p-226-2,LIT
"sous blister , portés .",SEN:3,e17p-226-3,LIT
"Livraison internationale , hors Norvège et Maghreb , me contacter .",SEN:4,e17p-226-4,LIT
"Produit issu de la collection Art of Snow White Couverture rigide en imitation cuir , avec détails en relief Première de couverture avec cadre métallique en relief orné de pierres précieuses Inscription "" Mirror , mirror , on the wall , who' s the fairest of them all "" ( Miroir magique au mur , qui a beauté parfaite et pure ? )",SEN:0,e17p-227-0,LIT
"Le cadre peut accueillir un portrait de Blanche Neige interchangeable Le carnet est fourni avec cinq portraits différents Motif travaillé et bordure dorée La face interne de la première de couverture comporte une enveloppe intégrée pour placer les portraits Tournez le portrait de votre choix vers l' extérieur pour qu' il apparaisse dans le cadre Le carnet contient environ 80 pages à lignes décorées et bordées d' or , ainsi qu' un marque-page",SEN:1,e17p-227-1,LIT
"en satin arborant une breloque métallique en forme de pomme Dimensions du carnet : H 20,5 x l 15,5 cm environ",SEN:2,e17p-227-2,LIT
Cuillère de collection avec écusson ZURICH - SUISSE Taille 12 cm - poids 11 g,SEN:0,e17p-228-0,LIT
"Plâtre publicitaire "" Carambar "" Dimensions : 22x23x10 cm Cette figurine en plâtre est en excellent état .",SEN:0,e17p-229-0,LIT
Aucun éclat Belle patine .,SEN:1,e17p-229-1,LIT
Emballage hyper soigné et renforcé -,SEN:2,e17p-229-2,LIT
"Potence émaillée double faces en bon état photos à la demande , émaillerie alsacienne Strasbourg .",SEN:0,e17p-230-0,LIT
Plaque hauteur 50 cm Très bon état Bonne enchère .....,SEN:0,e17p-231-0,LIT
AUTHENTIQUE caisse bois de repartition pharmaceutique IFP répondant au nom du grossiste de l' époque .,SEN:0,e17p-232-0,LIT
"Datée de 1954 Dimension TRES RARE , Possibilité de vente par lots .",SEN:1,e17p-232-1,LIT
3 Chromos Singer très bon état fleur de coin .,SEN:0,e17p-233-0,LIT
Thème expo universelle 1900 .,SEN:1,e17p-233-1,LIT
Publicité des machine Singer .,SEN:2,e17p-233-2,LIT
Palais de la céramique et de la verrerie .,SEN:3,e17p-233-3,LIT
Palais des mines et de la métallurgie .,SEN:4,e17p-233-4,LIT
Palais des armées de terre et de mer .,SEN:5,e17p-233-5,LIT
Autocollant en bon état Possibilité de regrouper vos achats pour payer moins de frais d' envoi,SEN:0,e17p-234-0,LIT
"cendrier ricard MONDIAL RELAY N' oubliez pas de me préciser le point relais de votre choix ainsi qu' un numéro de téléphone portable pour que vous soyez prévenu de l' arriver de votre colis en point relais , si aucune réponse je choisirais le plus près de votre domicile .",SEN:0,e17p-235-0,LIT
"Possibilité de faire livrer en point relais Espagne 7,80 euros Belgique 4,20 euros Luxembourg 4,20 euros Tarifs internationaux a domicile 9,80 pour les pays suivant : Allemagne , Royaume - Uni ,",SEN:1,e17p-235-1,LIT
"Belgique , Luxembourg , Autriche , Espagne , Portugal et Italie si votre pays ne figure pas dans cette liste veuillez me contacter avant d' encherrir que je vous communique les frais de port .",SEN:2,e17p-235-2,LIT
Attention toutes acheteurs dont le pays ne figure pas dans la liste aura son enchère annulé s' il ne m' a pas contacté avant .,SEN:3,e17p-235-3,LIT
"Si vous préférez etre livré par la poste , veuillez me l' informer très vite , mais le coût de livraison sera plus élever .",SEN:4,e17p-235-4,LIT
"Étiquettes En Sérigraphie , pas en papier Hauteur 59 cm Bon Etats voir photos",SEN:0,e17p-236-0,LIT
Autocollant Sport .,SEN:0,e17p-237-0,LIT
Le Coq Sportif lot de 4 autocollants .,SEN:1,e17p-237-1,LIT
Voir mes autres ventes .,SEN:2,e17p-237-2,LIT
les frais d' envoi seront révisés en cas d' achat multiple .,SEN:3,e17p-237-3,LIT
LOT BROCANTE COMPRENANT : Cafetière en Porcelaine de Paris XIXème Divers statuettes religieuses Etui à cigarettes en argent ( 52 grammes ) Art Nouveau Six assiettes à dessert en porcelaine non marquées Monnaies en aluminium 2 francs et 1 franc années 40 Bracelet en métal Etui à tickets en cuir Et divers Etat : Bon état pour l' ensemble sauf la cafetière qui a un éclat sous le bord et ce n' est pas son couvercle - Etui à cigarettes qui ne ferme pas à restaurer - Voir photos Paiement par Paypal ou virement bancaire - Chèques non acceptés Envoi rapide et soigné par Mondial Relay ou colissimo Pour toute question supplémentaire utiliser la rubrique messages ou mon adresse mail .,SEN:0,e17p-238-0,LIT
Expédition possible dans le monde - Shipping possible in the world,SEN:1,e17p-238-1,LIT
"Maquette HOGAN BOEING 777 300ER AIR FRANCE Échelle 1/200 OFFICIALLY LICENSED PRODUCT Superbe Maquette officielle du BOEING 777 300ER AIR FRANCE Longueur 36 cm / Largeur ( Envergure ) 32,5 cm / Boite ouverte ance Boite uniquement pour les photos Contenu : Maquette + Support en Bois et Aluminium brossé avec plaque gravée + Train d' atterrissage sous blister non ouvert à signaler : une trace de scotch sur la boite",SEN:0,e17p-239-0,LIT
"JUNKERS JUMO 211 compresseur / turbo Pièce d' origine seconde guerre mondiale ww2 , BE global , non grippé , conservé en milieu sain et sec .",SEN:0,e17p-240-0,LIT
"Messerschmitt , Focke .",SEN:1,e17p-240-1,LIT
"JU87 , JU 88 , HE111 , JU87 Stuka Autres photos et renseignements sur demande .",SEN:2,e17p-240-2,LIT
International bidders are welcolme .,SEN:3,e17p-240-3,LIT
Contact me for shipping informations and price .,SEN:4,e17p-240-4,LIT
British Airways Airbus A319 Safety Card ( issue 3 ) .,SEN:0,e17p-241-0,LIT
Ouvrage spécialisé dans l' aviation soviétique en langue anglaise Red Star - Volume 19 - Année 2004 ( exemplaire rare ) Titre : Soviet Heavy Interceptors Auteur : Yefim Gordon Comme neuf,SEN:0,e17p-242-0,LIT
Très bon état pour ce menu du 28 Novembre 1988 .. New - York / Paris,SEN:0,e17p-243-0,LIT
Frais regroupés pour plusieurs achats .,SEN:1,e17p-243-1,LIT
CARTE POSTALE DU MEETING D' AVIATION DE LYON .,SEN:0,e17p-244-0,LIT
VAN DEN BORN EN PLEIN VOL SUR BIPLAN H.,SEN:1,e17p-244-1,ORAL
FARMAN .,SEN:2,e17p-244-2,LIT
MOTEUR GNOME .,SEN:3,e17p-244-3,LIT
"NON VOYAGEE MAIS ECRITE DE LA MAIN DU PILOTE : "" AMICAL SOUVENIR DU MEETING DE LYON SIGNE VAN DEN BORN "" .",SEN:4,e17p-244-4,LIT
BON ETAT .,SEN:5,e17p-244-5,LIT
Maravillas con variationes acrostaticas .,SEN:0,e17p-245-0,ORAL
"en el jardin de Miro Nr 8 35,7 x 49.8",SEN:1,e17p-245-1,LIT
cm avec/ mit Passpartout 59 x45 cm E / A.,SEN:2,e17p-245-2,LIT
- maravillas en crayon / Bleistift,SEN:3,e17p-245-3,LIT
Etrier frein à disque roue avant .,SEN:0,e17p-246-0,LIT
O.E.M,SEN:1,e17p-246-1,ORAL
": Messier - Hispano ,",SEN:2,e17p-246-2,LIT
15 x 19 x 17 cm .,SEN:3,e17p-246-3,LIT
1000 gr document du commissaire priseur fourni Concorde spare part in mint conditions,SEN:4,e17p-246-4,LIT
Compagnie CCM Airbus A320 Échelle 1 / 200 Hogan Wings,SEN:0,e17p-247-0,LIT
7 LETTRES OFFICIELES PREMIERE LIAISON AERIENNE PAR LA Cie .,SEN:0,e17p-248-0,LIT
B.O.A.C.,SEN:1,e17p-248-1,ORAL
AUCKLAND / SYDNEY .,SEN:2,e17p-248-2,LIT
HONG KONG /FRANCFORT .,SEN:3,e17p-248-3,LIT
LONDRES / MANILLE ET RETOUR .,SEN:4,e17p-248-4,LIT
MANILLE / FRANCFORT .,SEN:5,e17p-248-5,LIT
LONDRES / TEL AVIV ET RETOUR EN COMET 4 PAR LA COMPAGNIE B.O.A.C.,SEN:6,e17p-248-6,LIT
"OBLITERATIONS 31/03/1960 , 1/04/60 .",SEN:7,e17p-248-7,LIT
2/11/1961 .,SEN:8,e17p-248-8,LIT
31/10/1961 .,SEN:9,e17p-248-9,LIT
6/04/1963 .,SEN:10,e17p-248-10,LIT
19/07/1957 .,SEN:11,e17p-248-11,LIT
CACHETS D' ARRIVEE SUR LES 7 PLIS .,SEN:12,e17p-248-12,LIT
TRES BON ETAT .,SEN:13,e17p-248-13,LIT
"7 syphons de Lorraine ( collection personnelle ) les objets sont en bon état , pas d' éclats metz devant les ponts metz X 2 vezelise thionville maizieres les metz basse yutz",SEN:0,e17p-249-0,LIT
"lot de tires bouchons acient assez bon état générale quelques manque superficielles , divers marques pour tout renseignements complémentaires veuillez me contacter , très bon enchère a toutes et a tous .",SEN:0,e17p-250-0,LIT
importent les tarif internationaux de livraison sont a titre indicatif couvrent la zone euro et peuvent varier en fonction de la zone ou l on ce situe,SEN:1,e17p-250-1,LIT
rare ancien pyrogène absinthe salin - pontarlier,SEN:0,e17p-251-0,LIT
petitot et gauthier extrait d ' absinthe sapin - quina,SEN:1,e17p-251-1,LIT
marquer dessous J.P,SEN:2,e17p-251-2,ORAL
-L France ébrécher sur le dessus voir photo ce qui enlève rien a son charme,SEN:3,e17p-251-3,LIT
ancien seau a champagne en laiton a restaurer voir photos vendu dans l état hauteur 22 cm diamètre 25 cm envoi colis monde voir tarif,SEN:0,e17p-252-0,LIT
"Siphon gazogène Briet Siphon à base en porcelaine blanche / Double réservoirs en verre clissé d' un cannage / Robinet e étain Marqué "" Gazogène Briet "" / Fin 19ième - début 20ième Hauteur totale : 42,5 cm Diamètre de la base : 16,5 cm Manque de cannage sur un des côtés , visible sur les photographies Plus de photos sur demande .",SEN:0,e17p-253-0,LIT
Merci de noter que l' envoi sera effectué 7 jours après l' encaissement du règlement .,SEN:1,e17p-253-1,LIT
5 MIGNONNETTES COGNAC HENNESSY SCELLEE OUVERTE FULL SEALED NEVER OPEN SHIPPING FEES : EUROPE 18 euros LIVRAISON MONDIAL RELAY POSSIBLE : 7 euros .,SEN:0,e17p-254-0,LIT
LIVRAISON AVANT NOËL .,SEN:1,e17p-254-1,LIT
whisky whiskies armagnac cognac calvados vins champagne bordeaux bourgogne,SEN:2,e17p-254-2,ORAL
Étiquette du château mouton Rothschild 1986 .,SEN:0,e17p-255-0,LIT
Étiquette en très bon état .,SEN:1,e17p-255-1,LIT
Paiement uniquement par PayPal .,SEN:2,e17p-255-2,LIT
Bonne enchères à tous .,SEN:3,e17p-255-3,LIT
état impeccable !,SEN:0,e17p-256-0,LIT
étiquette neuve,SEN:0,e17p-257-0,ORAL
La peinture Créatex Transparente Ultramarine Blue est une peinture acrylique spécialement conçue pour l' application à l' aérographe avec une buse d' environ 0.5,SEN:0,e17p-258-0,LIT
mm ou au pistolet à peinture .,SEN:1,e17p-258-1,LIT
Pour une utilisation avec un aérographe muni d' une buse inférieure à 0.5,SEN:2,e17p-258-2,LIT
"mm il sera nécessaire de diluer la peinture Créatex Opaque avec le diluant Créatex Reducer , proposé en différentes capacités 60ml , 120ml , 480ml et 960ml dans la catégorie Créatex Bases et Additifs .",SEN:3,e17p-258-3,LIT
Le pouvoir de recouvrement de cette peinture est l' un des plus performant de toutes les marques de peinture acrylique du marché .,SEN:4,e17p-258-4,LIT
Toutes les peintures Créatex sont miscibles entre elles .,SEN:5,e17p-258-5,LIT
vend chevalet en bois pliant en tres bonne etat,SEN:0,e17p-259-0,LIT
Tablier de peinture pour enfant Marque : Cars de DISNEY Taille 10ans Rouge avec impression de Cars fermeture par une pression derrière poche qui s' est décrochée du tablier mais qui ne gène en rien à l' utilisation Etat correct Enchérissez seulement si vous voulez réellement l' article .,SEN:0,e17p-260-0,LIT
"Merci Me contacter dès la fin de la vente , car les frais de livraison seront calculés .",SEN:1,e17p-260-1,LIT
Voir mes autres ventes pour frais groupés .,SEN:2,e17p-260-2,LIT
Paiement par chèque ou par PAYPAL .,SEN:3,e17p-260-3,LIT
Envoi rapide dès réception du règlement .,SEN:4,e17p-260-4,LIT
Dépôt des colis le mercredi ou le samedi .,SEN:5,e17p-260-5,LIT
"Les frais de livraison comprennent les frais EBAY , les frais PAYPAL et les frais d' envoi .",SEN:6,e17p-260-6,LIT
Les tarifs sont donc variables selon l' article et son poids .,SEN:7,e17p-260-7,LIT
"ATTENTION , certains articles ne peuvent pas être envoyés en format lettre .",SEN:8,e17p-260-8,LIT
"Envoi possible : - en relais colis "" MONDIAL RELAY "" , au tarif de 4,40 € ( merci d' indiquer l' adresse de votre point relais ) .",SEN:9,e17p-260-9,LIT
"- en colissimo , tarif variable de 5,50 € à 9,10 € , ( merci d' indiquer votre adresse ) - en lettre , tarif variable de 1,30 € à 3,80 € , ( merci d' indiquer votre adresse ) - en mains propres , gratuit",SEN:10,e17p-260-10,LIT
Motif floral Tête de ganesh servi !,SEN:0,e17p-261-0,LIT
"Mandala Designer ( Jeu Ravensburger ) , machine à dessiner les mandalas , en très bon état .",SEN:0,e17p-262-0,LIT
"Vendue avec 2 pochoirs , tampons+encre et crayons de couleurs , la machine possède un plateau tournant .",SEN:1,e17p-262-1,LIT
Très belle palette,SEN:0,e17p-263-0,ORAL
"2 petites coupelles en fer blanc , assemblée pour être accrochées au chevalet du peintre et y mettre la matière souhaitée .",SEN:0,e17p-264-0,LIT
"Diamètre de chaque 5,5 cm , profondeur 1,3 cm .",SEN:1,e17p-264-1,LIT
Identifiée d' un poinçon Italie,SEN:2,e17p-264-2,LIT
vends occasion bon état lot de pochoir pour peindre alphabet et chiffre 4 alphabets taille environ 2 cm - 4 cm - 6 cm - 10 cm complet avec en + le & 3 chiffres taille environ 2 cm - 4 cm - 6 cm complet,SEN:0,e17p-265-0,LIT
Dessin de Johnny hallyday taille a3 .,SEN:0,e17p-266-0,LIT
Vends un Numéro d' art La reine des Neiges 7 ans et + Neuf sous emballage Idéal pour Noël Envoi rapide et soigné,SEN:0,e17p-267-0,LIT
"Lot de 7 Aiguilles Anciens TRICOT , CROCHET de fabrication Anglaise , de très petite à moyenne taille .",SEN:0,e17p-268-0,LIT
NEUF MAIS EMBALLAGE DEFRAICHI .,SEN:0,e17p-269-0,LIT
"Canevas "" En forêt "" de Margot aux couleurs de l' automne Réf .",SEN:0,e17p-270-0,LIT
173.3094,SEN:1,e17p-270-1,ORAL
"Broderie fait main au point de croix ( fils perlés de DMC ) Format de la toile 127 x 63 cm Format du paysage 112 x 50 cm Neuf , encadré !",SEN:2,e17p-270-2,LIT
"Grille point de croix compté "" MA PROVENCE "" Marque LILI POINTS La grille est neuve ( utilisée ) ( vendue 10 euros en boutique )",SEN:0,e17p-271-0,LIT
Kit complet de Lanarte Maria van Scharrenburg Hibiscus Neuf,SEN:0,e17p-272-0,LIT
Ancienne malette année 1960 ronde tissu style tapisserie et cuir ( vintage ) .,SEN:0,e17p-273-0,LIT
doublure coton marron intérieur avec petite poche .,SEN:1,e17p-273-1,LIT
j ' ai pas de clés .,SEN:2,e17p-273-2,LIT
diamétre 26 cm .,SEN:3,e17p-273-3,LIT
envoi soigné .,SEN:4,e17p-273-4,LIT
"10 pelotes Phildar Coton Phil 51 Coloris n° 423 ( noir ) , même bain .",SEN:0,e17p-274-0,LIT
"51 % coton , 49 % acrylique .",SEN:1,e17p-274-1,LIT
"Aiguilles 2 - 3 , 116 m.",SEN:2,e17p-274-2,LIT
"Échantillon 10 x 10 cm : 25 mailles , 34 rangs .",SEN:3,e17p-274-3,LIT
"Kit support filtre à café , à broder sur partie aida .",SEN:0,e17p-275-0,LIT
Fils et grille compris .,SEN:1,e17p-275-1,LIT
"Merci d' attendre mon avis de paiement , les frais de port seront recalculés "" aux frais réels "" .",SEN:2,e17p-275-2,LIT
"rouleau de passepoil bleu clair coton , 1 cm de largueur 800 grs je n ' est pas mesurer mais je pense 200 m pour l ' étranger demander un devis pour les frais d ' envoi",SEN:0,e17p-276-0,LIT
"compteur pour machine à tricoter PASSAP - Vintage - ancien - en état de marche - OK Pour certains pays d' Europe , Mondial - Relay",SEN:0,e17p-277-0,LIT
possible .,SEN:1,e17p-277-1,LIT
Me contacter .,SEN:2,e17p-277-2,LIT
"Sur épingles Plus de 70 modèles originaux de colliers , bracelets , boucles d' oreilles et broches Dominique Hervé Collection « Faites Vous - Même",SEN:0,e17p-278-0,LIT
"» Performance Editions Didier Carpentier Dépôt légal janvier 2002 Référence 20029 ISSN 1151 - 616X ISBN 2 - 84167 - 188 - 7 EAN 9782841671885 29,2 x 22,3 x 0,8 cm 62 pages Très bon état Chasse de queue légèrement aplatie sur 1,5 cm",SEN:1,e17p-278-1,LIT
Ancien coffret à perles 2 étages D' occasion Environ 13 cm de hauteur et 24 cm de largeur Livraison Mondiale Hors U.E.,SEN:0,e17p-279-0,LIT
demander tarif,SEN:1,e17p-279-1,LIT
Naturel rouge yemeni agate convient pour fabrication de pendentif,SEN:0,e17p-280-0,LIT
"Gros lot de perles swarovski , toupies 3 mm - 108 perles vert et violet - 26 vertes - 68 roses - 70 différents marron - 50 turquoises jet AB2x - 57 orange - 60 différents bleus - quelques rouges",SEN:0,e17p-281-0,LIT
"Vends crée tes bijoux , kit en poche , 12 modèles à réaliser , neuf",SEN:0,e17p-282-0,LIT
"Le goût de la fête , à la table de Picasso par Ermine Herscher .",SEN:0,e17p-283-0,LIT
"Édition Alain Michel , 1996 Picasso l espagnol , qui n oubliera jamais ses racines , Picasso l artiste aux mille facettes , Picasso l amoureux fou des femmes , l ami des poètes , tous ont tressé un hymne au bonheur de vivre .",SEN:1,e17p-283-1,LIT
"Avec une égale ferveur , l homme a goûté la fête le plaisir des plats partagés .",SEN:2,e17p-283-2,LIT
"Les souvenirs de ses proches sont l occasion de déguster les recettes que Picasso à aimées : la zarzuela aux couleurs de l Espagne ? ? , le",SEN:3,e17p-283-3,LIT
"cari d Ambroise Hollande , la rata au lard de Fernande , ou les fruits déguisés d Olga .",SEN:4,e17p-283-4,LIT
Ce livre offre mille moments intimes auprès d un génie dont l insatiable vitalité ne cesse de nous éblouir .,SEN:5,e17p-283-5,LIT
Excellent état,SEN:6,e17p-283-6,LIT
Je vous propose ce kit complet visible sur CDSICOUNT a 9.90,SEN:0,e17p-284-0,LIT
€ sans les frais de port ( 6.50,SEN:1,e17p-284-1,LIT
€ ) : Chez moi neuve c' est 7 € + 3 € seulement de frais de port 5 boites 6 € piece 10 boites 5 € piece 50 boites 4 € piece,SEN:2,e17p-284-2,LIT
LIVRE PERLES CREATIVES N ° 5 ... NEUF,SEN:0,e17p-285-0,ORAL
Des idées tendance pour créer bijoux et accessoires Dans ce fascicule perles de rocailles fournies pour réaliser des broches Autres motifs sympa à l' intérieur .,SEN:1,e17p-285-1,LIT
Kit élastiques loom lips rainbow bands loisirs créatifs Kit de Creation Rainbow Loom Tout ce qu' il faut pour fabriquer des bracelets geniaux !,SEN:0,e17p-286-0,LIT
Faites des motifs complexes grace au metier extensible Rianbow Loom,SEN:1,e17p-286-1,LIT
"Livre "" bugle bead bonanza "" En anglais projets expliqués en anglais pour fabriquer ses bijoux Bon état",SEN:0,e17p-287-0,LIT
MERCI DE BIEN LIRE LA DESCRIPTION DE L OBJET AVANT D' ENCHERIR ET SURTOUT AVANT DE METTRE UNE EVALUATION NON APPROPRIEE A L' OBJET .,SEN:0,e17p-288-0,LIT
"Ciseaux de broderie , couture , mercerie ancienne .",SEN:1,e17p-288-1,LIT
"Une paire de ciseaux de borderie , en argent présence des poinçons .",SEN:2,e17p-288-2,LIT
Un joli travail dessus et en bon état .,SEN:3,e17p-288-3,LIT
"Poids 11,53 g , longueur 10,3 cm , largeur maxi 4,3 cm ( voir photos ) CONSIDERATIONS GENERALES DE VENTE : Regardez bien les photos AVEC ATTENTION avant d' enchérir , elles font parties intégrantes de la description .",SEN:4,e17p-288-4,LIT
Je regroupe mes ventes afin de réduire les frais de port pour l' acheteur .,SEN:5,e17p-288-5,LIT
"Un problème , n' importe quoi , contacter moi avant l' évaluation ou autres décisions , le dialogue vaut toujours mieux .",SEN:6,e17p-288-6,LIT
